index,published,keyword,domain,language,valid,title,description,url,image,archive,content,quote,de,en,la,added
64c1a71dd6a51660b509dd84ec8165fc,2026-07-04T17:14:26Z,'Starkregen',www.bild.de,de,0.9,Flut-Chaos in Istanbul - Starkregen legt die Stadt lahm,"Straßen stehen unter Wasser, Fahrzeuge stecken fest: Starkregen trifft mehrere Stadtteile von Istanbul.",https://www.bild.de/news/ausland/regen-schock-am-bosporus-istanbul-kaempft-mit-wassermassen-6a493b280b14ed961bb51ff9,"https://images.bild.de/6a493b280b14ed961bb51ff9/9e488b8217519a6e8d7ee4b981323191,b1e4dc12?w=1280",http://web.archive.org/web/20260704193835/https://www.bild.de/news/ausland/regen-schock-am-bosporus-istanbul-kaempft-mit-wassermassen-6a493b280b14ed961bb51ff9,"Mehr zum Video anzeigen 
Straßen stehen unter Wasser, Fahrzeuge stecken fest: Starkregen trifft mehrere Stadtteile von Istanbul.
Quelle: x.com04.07.2026 - 19:14 Uhr",,"Flut-Chaos in Istanbul - Starkregen legt die Stadt lahm. Straßen stehen unter Wasser, Fahrzeuge stecken fest: Starkregen trifft mehrere Stadtteile von Istanbul.","Flood chaos in Istanbul - heavy rain paralyzes the city. Streets are flooded, vehicles are stuck: heavy rain hits several districts of Istanbul.","Diluvium chaos in Istanbul — imber gravis urbem torpescit. Plateae inundantur, vehicula haeserunt: pluviae pluviae complures regiones Istanbul percusserunt.",2026-07-08 06:14:38+00:00
26c732999850ec503214676ddd63acd9,2026-07-06T13:51:59Z,'Starkregen',orf.at,de,0.9,Dammbruch nach Starkregen in Südchina,,https://orf.at/stories/3435436/,https://orf.at/mojo/1_4_1/storyserver//news/common/images/og-fallback-news.png,http://web.archive.org/web/20260707053753/https://orf.at/stories/3435436/,Nach einem Dammbruch an einem Stausee in Südchina gilt für das betroffene Gebiet die höchste Hochwasserwarnstufe. Der Bruch ereignete sich heute am Liulan-Stausee in Hengzhou in der südchinesischen R… [+1019 chars],,Dammbruch nach Starkregen in Südchina. None,Dam burst after heavy rain in southern China. None,Dam post pluviam in Sinis australibus erupit. Nullus,2026-07-08 06:14:38+00:00
e488ed348c1970ae8a240f0a15759493,2026-07-05T05:20:00Z,'Unwetterwarnung',www.focus.de,de,0.9,Gewitter-Chaos vor Trump-Rede: Tausende Besucher evakuiert,"Die Feier zum 250. Jahrestag der Unabhängigkeit zog sich wegen einer Unwetterwarnung bis tief in die Nacht. Der Veranstaltungsort, an dem Donald Trump seine Rede halten wollte, musste evakuiert werden.",https://www.focus.de/politik/ausland/gewitter-chaos-vor-trump-rede-tausende-besucher-evakuiert_029f48c9-ee78-410c-9581-1ddba74c8e45.html,"https://quadro.burda-forward.de/ctf/e2ada22b-175c-4fc4-8bee-b1028aa779c1.b6d4af19-339b-4ae8-a5a0-8eceb4b3f059.jpeg?im=RegionOfInterestCrop=(1200,630),regionOfInterest=(868,691)&hash=a8fe83aef0e8a29339145f3a5841b2efbb0066ed43af35c53479ed1082478477",http://web.archive.org/web/20260705160826/https://www.focus.de/politik/ausland/gewitter-chaos-vor-trump-rede-tausende-besucher-evakuiert_029f48c9-ee78-410c-9581-1ddba74c8e45.html,Das Wetter beeinträchtigte die Feierlaune - nicht nur in Washington. Seit Tagen ächzt die US-Hauptstadt unter Temperaturen von fast 40 Grad. Auf die Hitze folgte am Abend dann der Donner: Wegen einer… [+2482 chars],,"Gewitter-Chaos vor Trump-Rede: Tausende Besucher evakuiert. Die Feier zum 250. Jahrestag der Unabhängigkeit zog sich wegen einer Unwetterwarnung bis tief in die Nacht. Der Veranstaltungsort, an dem Donald Trump seine Rede halten wollte, musste evakuiert werden.",Thunderstorm chaos before Trump speech: thousands of visitors evacuated. The celebration of the 250th anniversary of independence dragged on until late into the night due to a severe weather warning. The venue where Donald Trump planned to give his speech had to be evacuated.,Tonitruum chaos ante BUCINUM loquela: milia salutantium evacuentur. Celebratio 250th anniversarii independentiae in seram usque in noctem pertractatur ob gravem tempestatem admonitionem. De visneto ubi Donald Trump cogitavit orationem suam decedi.,2026-07-09 17:03:34+00:00
f5dc2ac6dad322530ff8f82cef2f2e76,2026-07-01T05:38:03Z,'Unwetter Regen',www.tagesspiegel.de,de,0.8,Nach Hitze kommt Regen: Immer wieder Unwetter in Berlin und Brandenburg,"Stürmische Böen, Hagel und schwankende Temperaturen: Das Wetter in Berlin und Brandenburg bleibt launisch.",https://www.tagesspiegel.de/berlin/nach-hitze-kommt-regen-immer-wieder-unwetter-in-berlin-und-brandenburg-15779690.html,https://www.tagesspiegel.de/images/15779689/alternates/BASE_16_9_W1400/1782884283000/wetter-in-berlin.jpeg,http://web.archive.org/web/20260702072744/https://www.tagesspiegel.de/berlin/nach-hitze-kommt-regen-immer-wieder-unwetter-in-berlin-und-brandenburg-15779690.html,"Die kommenden Tage werden eine Mischung aus Regen, Sonne und Gewittern in Berlin und Brandenburg. Heute wird es turbulent, wie der Deutsche Wetterdienst (DWD) mitteilte. Demnach sei im Tagesverlauf m… [+989 chars]",,"Nach Hitze kommt Regen: Immer wieder Unwetter in Berlin und Brandenburg. Stürmische Böen, Hagel und schwankende Temperaturen: Das Wetter in Berlin und Brandenburg bleibt launisch.","After heat comes rain: repeated storms in Berlin and Brandenburg. Stormy gusts, hail and fluctuating temperatures: the weather in Berlin and Brandenburg remains moody.","Post calorem venit pluvia: crebrae tempestates Berolini et Brandenburgici. Tempestates procellae, grandines et temperaturae fluctuantes: tempestas Berolini et Brandenburgici tristis manet.",2026-07-12 10:09:43+00:00
cbdb3ac25ec740c3d174ef7de7b43520,2026-07-11T18:45:42Z,'Unwetter Regen',www.faz.net,de,0.8,Unwetter in den USA: In Missouri müssen hunderte Menschen nach Sturzfluten gerettet werden,Sintflutartige Regenfälle haben im US-Bundesstatt Missouri für heftige Überflutungen gesorgt. Einsatzkräfte retten Kinder aus einem Sommercamp. Es drohen weitere Unwetter.,https://www.faz.net/aktuell/gesellschaft/ungluecke/usa-hunderte-menschen-nach-sturzfluten-in-missouri-gerettet-201021050.html,https://media0.faz.net/image/w1200h627/7abba57f0a41/w2439h1274x0y176o/202607/43601.0.2325353039/die-amerikanische-stadt.webp,http://web.archive.org/web/20260711195225/https://www.faz.net/aktuell/gesellschaft/ungluecke/usa-hunderte-menschen-nach-sturzfluten-in-missouri-gerettet-201021050.html,"Nach heftigen Regenfällen und Sturzfluten im US-Bundesstaat Missouri haben Einsatzkräfte Hunderte Menschen aus den Fluten gerettet. Besonders betroffen war der Südosten des Bundesstaats, wo US-Medien… [+1341 chars]",,Unwetter in den USA: In Missouri müssen hunderte Menschen nach Sturzfluten gerettet werden. Sintflutartige Regenfälle haben im US-Bundesstatt Missouri für heftige Überflutungen gesorgt. Einsatzkräfte retten Kinder aus einem Sommercamp. Es drohen weitere Unwetter.,Storms in the USA: Hundreds of people have to be rescued after flash floods in Missouri. Torrential rains have caused severe flooding in the US state of Missouri. Emergency services rescue children from a summer camp. There is a threat of further storms.,Procellae in USA: Centum hominum post diluvia in Missouri mico liberanda sunt. Imbres torrentes graves inundationes in Civitate Missouri in US fecerunt. Subitis officia liberis ex castris aestivis eripiunt. Est comminatio tempestatum longius.,2026-07-15 10:24:37+00:00
222a869d48bf0454d56ab1ead5437c1e,2026-07-14T10:00:41Z,'Regenmengen',www.bild.de,de,0.8,Gewitter und Unwetter - Wer zahlt bei Hagelschaden?,"Wetter-Chaos in Deutschland! Stürme, Regen und Gewitter richten innerhalb von Minuten große Zerstörungen an. Doch wer zahlt bei Schäden an Haus und Auto?",https://www.bild.de/leben-wissen/mein-recht-verbraucherportal/ueberschwemmung-was-die-versicherung-zahlt-und-was-nicht-6a55f3f104bf7e616bda7ee5,"https://images.bild.de/6a55f3f104bf7e616bda7ee5/94d867f8a4d4f3d4d49c02718025fe5a,3e1fd918?w=1280",,"TTS-Player überspringenArtikel weiterlesenErst trafen Starkregen, Hagel und Sturm am Montagabend Teile des Westens und Nordens. In der Nacht liefen Keller voll, Straßen standen unter Wasser, Autos un… [+3454 chars]",,"Gewitter und Unwetter - Wer zahlt bei Hagelschaden?. Wetter-Chaos in Deutschland! Stürme, Regen und Gewitter richten innerhalb von Minuten große Zerstörungen an. Doch wer zahlt bei Schäden an Haus und Auto?","Thunderstorms and storms - who pays for hail damage? Weather chaos in Germany! Storms, rain and thunderstorms cause great destruction within minutes. But who pays for damage to your house and car?","Procellae et procellae - Quis damnum luit grandinis? Tempestas chaos in Germania! Tempestates, pluviae et tonitrua magnam perniciem intus minutis faciunt. Sed quis domus ac currus damnum pensat?",2026-07-15 10:24:37+00:00
222ad9c88d1ad37a96ea216a7f385dc5,2026-07-15T09:09:00Z,'Hochwasser Starkregen',www.dw.com,de,0.9,Mehr Wassermangel: Wie wir Grundwasser schützen können,"Durch immer mehr Wetterextreme fehlt in Dürrezeiten Wasser, bei Starkregen gibt es zu viel. Wie gezieltes Speichern von Grundwasser hilft, Fluten einzudämmen und für Trockenzeiten vorzusorgen .",https://www.dw.com/de/mehr-wassermangel-wie-wir-grundwasser-sch%C3%BCtzen-k%C3%B6nnen/a-77345805,https://static.dw.com/image/77346216_6.jpg,,"Viele Böden in Deutschland sind schon jetzt viel zu trocken. Regen fehlte schon im Frühjahr, besonders im März. Auch der teils überdurchschnittliche Niederschlag in einigen Regionen im April und Mai … [+8140 chars]",,"Mehr Wassermangel: Wie wir Grundwasser schützen können. Durch immer mehr Wetterextreme fehlt in Dürrezeiten Wasser, bei Starkregen gibt es zu viel. Wie gezieltes Speichern von Grundwasser hilft, Fluten einzudämmen und für Trockenzeiten vorzusorgen .","More water shortage: How we can protect groundwater. Due to more and more extreme weather events, there is a lack of water in times of drought and there is too much in times of heavy rain. How targeted storage of groundwater helps to contain floods and prepare for dry periods.",Plus aquae penuria est: Quam groundwater tueri possumus. Ob nimiam tempestatem magis magisque eventibus aquae in tempore siccitatis defectus est et in tempore pluviae gravis nimis. Quomodo ceptaculum aquae fundamenti iaculis adiuvat ad diluvia continenda et ad tempus siccum praeparandum.,2026-07-16 16:00:29+00:00
e1a2696279e1f31c0183c94417a1b844,2026-07-14T10:00:00Z,'Starkregen',www.telepolis.de,de,0.9,Schwere Unwetter treffen Norddeutschland – Süden in Alarmbereitschaft,"Hagel, Sturm und Starkregen haben in Norddeutschland massive Schäden angerichtet. Der Deutsche Wetterdienst warnt indes vor der nächsten Wettergefahr im Süden.",https://www.telepolis.de/article/Schwere-Unwetter-treffen-Norddeutschland-Sueden-in-Alarmbereitschaft-11364223.html,https://heise.cloudimg.io/bound/1200x1200/q85.png-lossy-85.webp-lossy-85.foil1/_www-heise-de_/imgs/18/5/1/1/6/5/6/4/shutterstock_2732146063-aa6a6282ad79e0e2.jpg,http://web.archive.org/web/20260714233643/https://www.telepolis.de/article/Schwere-Unwetter-treffen-Norddeutschland-Sueden-in-Alarmbereitschaft-11364223.html,"Heftige Gewitter haben in der Nacht zum Dienstag für Hagel gesorgt. Im Süden droht ab heute Nachmittag Unwettergefahr.
(Bild: RecCameraStock/Shutterstock.com)
Hagel, Sturm und Starkregen haben in N… [+6446 chars]",,"Schwere Unwetter treffen Norddeutschland – Süden in Alarmbereitschaft. Hagel, Sturm und Starkregen haben in Norddeutschland massive Schäden angerichtet. Der Deutsche Wetterdienst warnt indes vor der nächsten Wettergefahr im Süden.","Severe storms hit northern Germany - the south is on alert. Hail, storms and heavy rain have caused massive damage in northern Germany. The German Weather Service is warning of the next weather threat in the south.","Procellae graves Germaniam septentrionalem feriunt - meridies vigilat. Ave, procellae et pluviae magnae damnum in Germania septentrionali attulerunt. Ministerium Tempestatis Germanorum monet proximae tempestatis in meridie.",2026-07-17 21:24:58+00:00
af6b50d4d8e0c9813bec8fb1b29036fe,2026-07-14T10:58:32Z,'Unwettergefahr',www.faz.net,de,0.9,Hitze-Liveblog: Unwettergefahr bis zum Wochenende – dann wird es kühler,Besonders von der Mitte bis nach Süddeutschland +++ Wetterdienst: Hitze im Juni hat neue Maßstäbe gesetzt +++ Großer Waldbrand nahe Paris +++ alle Entwicklungen im Liveblog,https://www.faz.net/aktuell/gesellschaft/menschen/liveticker-zur-hitzewelle-in-deutschland-unwettergefahr-bis-zum-wochenende-dann-wird-es-kuehler-faz-200949959.html,https://media0.faz.net/image/w1200h627/a7de8847a498/w6000h3135x0y188o/202607/43601.0.2332757289/ein-blitz-schlaegt-am-morgen.webp,http://web.archive.org/web/20260714111557/https://www.faz.net/aktuell/gesellschaft/menschen/liveticker-zur-hitzewelle-in-deutschland-unwettergefahr-bis-zum-wochenende-dann-wird-es-kuehler-faz-200949959.html,"Im Kampf gegen einen Waldbrand im Großbrand Paris sind erstmals zwei Löschflugzeuge vom Typ Canadair entsandt worden.  Sie schöpfen ihr Löschwasser im Niedrigflug aus der Seine, wie auf zahlreichen V… [+433 chars]",,Hitze-Liveblog: Unwettergefahr bis zum Wochenende – dann wird es kühler. Besonders von der Mitte bis nach Süddeutschland +++ Wetterdienst: Hitze im Juni hat neue Maßstäbe gesetzt +++ Großer Waldbrand nahe Paris +++ alle Entwicklungen im Liveblog,Heat live blog: Danger of severe weather until the weekend - then it will get cooler. Especially from the middle to southern Germany +++ Weather service: Heat in June set new standards +++ Large forest fire near Paris +++ all developments in the live blog,Calor blog vive: Periculum tempestatis gravibus usque ad volutpat vestibulum - tunc frigidior erit. Praesertim a medio ad Germaniam meridianam +++ Tempestas religio: Calidum mense Iunio signa nova posuit +++ Magnae silvae incendia prope Parisios +++ omnes progressus in diario vivo,2026-07-17 21:24:58+00:00
2b840862fba450753536c88856118623,2026-07-13T17:43:10Z,'Unwetterwarnung',www.zeit.de,de,0.9,Wetter: DWD gibt Unwetterwarnung für Prignitz heraus,Hier finden Sie Informationen zu dem Thema „Wetter“. Lesen Sie jetzt „DWD gibt Unwetterwarnung für Prignitz heraus“.,https://www.zeit.de/news/2026-07/13/dwd-gibt-unwetterwarnung-fuer-prignitz-heraus,https://img.zeit.de/news/2026-07/13/dwd-gibt-unwetterwarnung-fuer-prignitz-heraus-image-group/wide__1300x731,http://web.archive.org/web/20260713192248/https://www.zeit.de/news/2026-07/13/dwd-gibt-unwetterwarnung-fuer-prignitz-heraus,"Der Deutsche Wetterdienst (DWD) warnt vor Unwettergefahren wegen schwerer Gewitter am Abend im Kreis Prignitz. Die Unwetterwarnung gelte bis voraussichtlich 20.00 Uhr, teilte der DWD am Abend kurzfri… [+291 chars]",,Wetter: DWD gibt Unwetterwarnung für Prignitz heraus. Hier finden Sie Informationen zu dem Thema „Wetter“. Lesen Sie jetzt „DWD gibt Unwetterwarnung für Prignitz heraus“.,Weather: DWD issues severe weather warning for Prignitz. Here you will find information on the topic of “weather”. Read now “DWD issues severe weather warning for Prignitz”.,"Tempestas: DWD gravibus tempestatibus admonitio Prignitz exit. Hic informationes invenies in argumento ""tempestatis"". Lege nunc ""DWD monentem pro Prignitz gravibus tempestatibus"".",2026-07-18 21:28:07+00:00
dc25eedc6460dd9f5f17b195a35f7891,2026-07-13T17:44:09Z,'Unwetterwarnung',www.tagesspiegel.de,de,0.9,Wetter: DWD gibt Unwetterwarnung für Prignitz heraus,"Blitz, Hage, Überflutungen? Der DWD gibt eine amtliche Unwetterwarnung vor schweren Gewittern für den Nordwesten Brandenburgs.",https://www.tagesspiegel.de/berlin/wetter-dwd-gibt-unwetterwarnung-fur-prignitz-heraus-15835077.html,https://www.tagesspiegel.de/images/15835076/alternates/BASE_16_9_W1400/1783964649000/unwetterwarnung-fur-prignitz.jpeg,http://web.archive.org/web/20260714101203/https://www.tagesspiegel.de/berlin/wetter-dwd-gibt-unwetterwarnung-fur-prignitz-heraus-15835077.html,"Der Deutsche Wetterdienst (DWD) warnt vor Unwettergefahren wegen schwerer Gewitter am Abend im Kreis Prignitz. Die Unwetterwarnung gelte bis voraussichtlich 20.00 Uhr, teilte der DWD am Abend kurzfri… [+345 chars]",,"Wetter: DWD gibt Unwetterwarnung für Prignitz heraus. Blitz, Hage, Überflutungen? Der DWD gibt eine amtliche Unwetterwarnung vor schweren Gewittern für den Nordwesten Brandenburgs.","Weather: DWD issues severe weather warning for Prignitz. Lightning, hail, floods? The DWD issues an official storm warning of severe thunderstorms for the northwest of Brandenburg.","Tempestas: DWD gravibus tempestatibus admonitio Prignitz exit. Fulgura, grando, flumina? DWD denuntiat tempestatem officialem gravium tonitribus propter septentrionem et chorum Brandenburgensem.",2026-07-18 21:28:07+00:00
db746544d38fd3cfd32d7f9d3ff84c0b,2026-07-14T15:21:28Z,'Unwetterwarnung',www.sueddeutsche.de,de,0.9,SZ am Abend: Nachrichten vom 17. Juli 2026,"News aktuell: Dubai plant Ausweichhafen, wohl extremistisches Motiv in Schongau, Unwetterwarnung",https://www.sueddeutsche.de/politik/news-dubai-hormus-schongau-unwetter-li.3516054,https://www.sueddeutsche.de/2026/07/14/6fe1f929-d678-4356-b671-70b6bbd71b19.jpg?q=60&fm=webp&width=1200&rect=0%2C656%2C3000%2C1687,http://web.archive.org/web/20260714170741/https://www.sueddeutsche.de/politik/news-dubai-hormus-schongau-unwetter-li.3516054,Amoklauf in Schongau: Ermittler gehen von extremistischem Motiv aus. Zwei Mädchen werden am Welfen-Gymnasium in Schongau bei der Attacke eines ehemaligen Mitschülers schwer verletzt. Polizisten und L… [+1772 chars],,"SZ am Abend: Nachrichten vom 17. Juli 2026. News aktuell: Dubai plant Ausweichhafen, wohl extremistisches Motiv in Schongau, Unwetterwarnung","SZ in the evening: News from July 17, 2026. Current news: Dubai is planning an alternative port, probably extremist motive in Schongau, severe weather warning","SZ vesperi: Nuntii a die 17 mensis Iulii anno 2026. Current nuntium: Dubai jocus portum agitat, probabiliter motivum extremistarum in Schongau, tempestatem gravem monens.",2026-07-18 21:28:07+00:00
d0b4c0bc9b9a11efe59b239bbe7cc674,2026-07-15T13:27:03Z,'Starkregen',www.zeit.de,de,0.9,Gewitter und Hagel: Hagelsturm und Starkregen - Unwetter im Südwesten,Hier finden Sie Informationen zu dem Thema „Gewitter und Hagel“. Lesen Sie jetzt „Hagelsturm und Starkregen - Unwetter im Südwesten“.,https://www.zeit.de/news/2026-07/15/hagelsturm-und-starkregen-unwetter-im-suedwesten,https://img.zeit.de/news/2026-07/15/hagelsturm-und-starkregen-unwetter-im-suedwesten-image-group/wide__1300x731,http://web.archive.org/web/20260716011812/https://www.zeit.de/news/2026-07/15/hagelsturm-und-starkregen-unwetter-im-suedwesten,"Über Baden-Württemberg ziehen weitere schwere Unwetter, diesmal mit Orkanböen, Hagel und heftigem Starkregen. Der Deutsche Wetterdienst (DWD) gab eine Unwetterwarnung heraus, die für das ganze Land b… [+3668 chars]",,Gewitter und Hagel: Hagelsturm und Starkregen - Unwetter im Südwesten. Hier finden Sie Informationen zu dem Thema „Gewitter und Hagel“. Lesen Sie jetzt „Hagelsturm und Starkregen - Unwetter im Südwesten“.,Thunderstorms and hail: Hailstorms and heavy rain - storms in the southwest. Here you will find information on the topic of “thunderstorms and hail”. Read “Hailstorm and heavy rain - storms in the southwest” now.,"Tonitruum et grando: grandines et pluviae - tempestates in Africo. Hic informationes invenies in argumento ""tonitruum et grandinis"". Lege ""Salvetor et pluvia - procellae in Africo"" nunc.",2026-07-18 21:28:07+00:00
b167d6979b855abf54fff08d760c7f23,2026-07-16T14:18:06Z,'Starkregen',www.zeit.de,de,0.9,Gewitterlage im Südwesten: Wetterdienst warnt vor Unwettern mit Hagel und Starkregen,Hier finden Sie Informationen zu dem Thema „Gewitterlage im Südwesten“. Lesen Sie jetzt „Wetterdienst warnt vor Unwettern mit Hagel und Starkregen“.,https://www.zeit.de/news/2026-07/16/wetterdienst-warnt-vor-unwettern-mit-hagel-und-starkregen,https://img.zeit.de/news/2026-07/16/wetterdienst-warnt-vor-unwettern-mit-hagel-und-starkregen-image-group/wide__1300x731,http://web.archive.org/web/20260716143817/https://www.zeit.de/news/2026-07/16/wetterdienst-warnt-vor-unwettern-mit-hagel-und-starkregen,"Nahezu ganz Baden-Württemberg muss im Tagesverlauf erneut mit heftigen Gewittern, Starkregen und Hagel rechnen. Der Deutsche Wetterdienst (DWD) veröffentlichte eine Unwetterwarnung für alle vier Regi… [+487 chars]",,Gewitterlage im Südwesten: Wetterdienst warnt vor Unwettern mit Hagel und Starkregen. Hier finden Sie Informationen zu dem Thema „Gewitterlage im Südwesten“. Lesen Sie jetzt „Wetterdienst warnt vor Unwettern mit Hagel und Starkregen“.,Thunderstorms in the southwest: Weather service warns of storms with hail and heavy rain. Here you will find information on the topic “Thunderstorm conditions in the southwest”. Now read “Weather service warns of storms with hail and heavy rain”.,"Procellae in Africo: Tempestas admonet tempestates ser- mones cum grandine et pluvia. Hic informationes invenies in themate ""condiciones tonitrui in Africo"". Nunc lege ""Tempestas officium monet procellas cum grandine et pluvia gravi"".",2026-07-18 21:28:07+00:00
41405c141dedc147bb2b8b57a9bc6227,2026-07-17T08:18:34Z,'Starkregen',www.zeit.de,de,0.9,Wetter: Gewitter und Starkregen in MV erwartet,Hier finden Sie Informationen zu dem Thema „Wetter“. Lesen Sie jetzt „Gewitter und Starkregen in MV erwartet“.,https://www.zeit.de/news/2026-07/17/gewitter-und-starkregen-in-mv-erwartet,https://img.zeit.de/news/2026-07/17/gewitter-und-starkregen-in-mv-erwartet-image-group/wide__1300x731,,Schwere Gewitter und heftiger Starkregen sind am Freitag in Mecklenburg-Vorpommern möglich. Eine entsprechende Vorabinformation des Deutschen Wetterdienstes (DWD) für Ostdeutschland gilt auch für MV.… [+925 chars],,Wetter: Gewitter und Starkregen in MV erwartet. Hier finden Sie Informationen zu dem Thema „Wetter“. Lesen Sie jetzt „Gewitter und Starkregen in MV erwartet“.,Weather: Thunderstorms and heavy rain expected in MV. Here you will find information on the topic of “weather”. Now read “Thunderstorms and heavy rain expected in MV”.,"Tempestas: Procellae et pluviae expectatae in MV. Hic informationes invenies in argumento ""tempestatis"". Nunc legitur ""Procellae et pluviae exspectatae in MV"".",2026-07-18 21:28:07+00:00
4a1a12dba7b25f055cf6fd61c0966bde,2026-07-17T12:14:34Z,'Unwetterwarnung',www.zeit.de,de,0.9,Wetterchaos geht weiter: Erneute Unwetterwarnung für den Südwesten: Heftige Gewitter,Hier finden Sie Informationen zu dem Thema „Wetterchaos geht weiter“. Lesen Sie jetzt „Erneute Unwetterwarnung für den Südwesten: Heftige Gewitter“.,https://www.zeit.de/news/2026-07/17/erneute-unwetterwarnung-fuer-den-suedwesten-heftige-gewitter,https://img.zeit.de/news/2026-07/17/erneute-unwetterwarnung-fuer-den-suedwesten-heftige-gewitter-image-group/wide__1300x731,,"Die Unwetter mit heftigen Gewittern, ergiebigem Starkregen und Hagel drehen in Baden-Württemberg eine weitere Runde: Der Deutsche Wetterdienst (DWD) gab eine Unwetterwarnung für alle vier Regierungsb… [+561 chars]",,Wetterchaos geht weiter: Erneute Unwetterwarnung für den Südwesten: Heftige Gewitter. Hier finden Sie Informationen zu dem Thema „Wetterchaos geht weiter“. Lesen Sie jetzt „Erneute Unwetterwarnung für den Südwesten: Heftige Gewitter“.,Weather chaos continues: Another severe weather warning for the southwest: violent thunderstorms. Here you will find information on the topic “Weather chaos continues”. Now read “Another severe weather warning for the southwest: severe thunderstorms”.,"Tempestas chaos prosequitur: Aliam tempestatem gravem praenuntius Africum: Tonitruum vehemens. Hic informationes invenies in argumento ""Tempestas chaos pergit"". Nunc lege ""Alia tempestatem gravem monentem pro Africo: tonitribus gravibus"".",2026-07-18 21:28:07+00:00
b16cdb4afe8b4d7e89d96e1449716b79,2026-07-17T15:42:47Z,'Starkregen',www.zeit.de,de,0.9,Wetterdienst: Unwetterwarnungen für MV - Gewitter und Starkregen,Hier finden Sie Informationen zu dem Thema „Wetterdienst“. Lesen Sie jetzt „Unwetterwarnungen für MV - Gewitter und Starkregen“.,https://www.zeit.de/news/2026-07/17/unwetterwarnungen-fuer-mv-gewitter-und-starkregen,https://img.zeit.de/news/2026-07/17/unwetterwarnungen-fuer-mv-gewitter-und-starkregen-image-group/wide__1300x731,http://web.archive.org/web/20260718024445/https://www.zeit.de/news/2026-07/17/unwetterwarnungen-fuer-mv-gewitter-und-starkregen,Der Deutsche Wetterdienst (DWD) hat amtliche Unwetterwarnungen für mehrere Landkreise in Mecklenburg-Vorpommern herausgegeben. Es bestehe die Gefahr schwerer Gewitter mit starkem Niederschlag und mög… [+667 chars],,Wetterdienst: Unwetterwarnungen für MV - Gewitter und Starkregen. Hier finden Sie Informationen zu dem Thema „Wetterdienst“. Lesen Sie jetzt „Unwetterwarnungen für MV - Gewitter und Starkregen“.,Weather Service: Severe weather warnings for MV - thunderstorms and heavy rain. Here you will find information on the topic of “Weather Service”. Read “Severe weather warnings for MV - thunderstorms and heavy rain” now.,"Weather Service: Gravis tempestas admonitiones pro MV - tonitribus et pluviae gravis. Hic informationes invenies in argumento ""Tempestatis servitii"". Lege ""Saeves tempestates admonitiones pro MV - tonitribus et pluviae graves"" nunc.",2026-07-18 21:28:07+00:00
