index,published,keyword,domain,language,valid,title,description,url,image,archive,content,quote,de,en,la,added
d218f1de01b3b2bb5c2fad30a7d100b3,2026-05-09T05:56:08Z,'Starkregen',www.zeit.de,de,0.9,Unwetter in Bayern: Wetterdienst warnt vor Gewittern und Starkregen im Süden,Hier finden Sie Informationen zu dem Thema „Unwetter in Bayern“. Lesen Sie jetzt „Wetterdienst warnt vor Gewittern und Starkregen im Süden“.,https://www.zeit.de/news/2026-05/09/wetterdienst-warnt-vor-gewittern-und-starkregen-im-sueden,https://img.zeit.de/news/2026-05/09/wetterdienst-warnt-vor-gewittern-und-starkregen-im-sueden-image-group/wide__1300x731,http://web.archive.org/web/20260510023401/https://www.zeit.de/news/2026-05/09/wetterdienst-warnt-vor-gewittern-und-starkregen-im-sueden,"Es blitzt und donnert mancherorts in Bayern am Wochenende. Während der Samstag in weiten Teilen des Freistaats noch freundlich bleibt, erwartet der Deutsche Wetterdienst (DWD) am Sonntag vor allem in… [+1150 chars]",,Unwetter in Bayern: Wetterdienst warnt vor Gewittern und Starkregen im Süden. Hier finden Sie Informationen zu dem Thema „Unwetter in Bayern“. Lesen Sie jetzt „Wetterdienst warnt vor Gewittern und Starkregen im Süden“.,Storms in Bavaria: Weather service warns of thunderstorms and heavy rain in the south. Here you will find information on the topic of “Severe weather in Bavaria”. Now read “Weather service warns of thunderstorms and heavy rain in the south”.,"Tempestates in Bavaria: Tempestas admonet ser- mones et imbres in austro. Hic informationes invenies in argumento ""Tempestatis Severae in Bavaria"". Nunc lege ""Tempestas officium admonet tonitribus et imbres in austro"".",2026-05-17 10:10:22+00:00
7722e5ccb02b6b61179949e989f9b30e,2026-05-10T08:16:24Z,'Starkregen',www.zeit.de,de,0.9,Wetter: Nach T-Shirt-Wetter drohen Starkregen und Gewitter im Süden,Hier finden Sie Informationen zu dem Thema „Wetter“. Lesen Sie jetzt „Nach T-Shirt-Wetter drohen Starkregen und Gewitter im Süden“.,https://www.zeit.de/news/2026-05/10/nach-t-shirt-wetter-drohen-starkregen-und-gewitter-im-sueden,https://img.zeit.de/news/2026-05/10/nach-t-shirt-wetter-drohen-starkregen-und-gewitter-im-sueden-image-group/wide__1300x731,,Nach einem sonnigen Sonntag erwarten die Menschen in Berlin und Brandenburg zum Wochenbeginn wieder Wolken und Regen. In der Nacht und am Montag selbst könne es vor allem im Süden Brandenburgs Starkr… [+415 chars],,Wetter: Nach T-Shirt-Wetter drohen Starkregen und Gewitter im Süden. Hier finden Sie Informationen zu dem Thema „Wetter“. Lesen Sie jetzt „Nach T-Shirt-Wetter drohen Starkregen und Gewitter im Süden“.,Weather: T-shirt weather threatens heavy rain and thunderstorms in the south. Here you will find information on the topic of “weather”. Now read “T-shirt weather threatens heavy rain and thunderstorms in the south”.,"Tempestas: tempestas subucula pluviae et tonitribus meridionalis imminet. Hic informationes invenies in argumento ""tempestatis"". Nunc lege ""tempestas T-shirt pluviam et tonitribus Australibus imminet"".",2026-05-17 10:10:22+00:00
accf34bf0867a86274afc142276276f8,2026-05-13T04:25:07Z,'Hangrutschung Niederschlag',noe.orf.at,de,0.3,Trotz Regens bleibt Lage angespannt,Nach Wochen der Trockenheit hat es in Niederösterreich zuletzt teils kräftig geregnet. Vor allem Landwirtschaft und Grundwasserspiegel leiden aber weiter unter dem Niederschlagsdefizit. Die Lage bleibe laut Experten angespannt.,https://noe.orf.at/stories/3353959/,https://ibs.orf.at/noe?image=https%3A%2F%2Foekastatic.orf.at%2Fmims%2F2025%2F31%2F73%2Fcrops%2Fw%3D1200%2Ch%3D627%2Cq%3D75%2F2715733_master_1045673_feld2.jpg%3Fs%3D7178e1fc8976ce604279d35db1193a551a787680,,In Teilen Niederösterreichs sind in den vergangenen Tagen beachtliche Regenmengen gefallen. Im Bezirk Neunkirchen sind österreichweit sind in den vergangenen fünf Tagen (8. bis 12. Mai) mitunter die … [+4905 chars],,Trotz Regens bleibt Lage angespannt. Nach Wochen der Trockenheit hat es in Niederösterreich zuletzt teils kräftig geregnet. Vor allem Landwirtschaft und Grundwasserspiegel leiden aber weiter unter dem Niederschlagsdefizit. Die Lage bleibe laut Experten angespannt.,"Despite the rain, the situation remains tense. After weeks of drought, it has recently rained heavily in Lower Austria. However, agriculture and groundwater levels in particular continue to suffer from the rainfall deficit. According to experts, the situation remains tense.","Quamvis pluvia, condicio temporis manet. Post septimanas siccitatis nuper in Austria inferiori graviter pluit. Attamen, agri culturae et aquae fundatae praesertim, de pluviis defectubus laborantibus pergunt. Secundum peritis condicio temporis manet.",2026-05-18 12:01:08+00:00
9459852eb7cc4d74e4bca2c3ef370842,2026-05-15T22:15:00Z,'Regenmengen',wien.orf.at,de,0.9,Waldbrandgefahr vorerst gebannt,"Die Waldbrandgefahr ist vorerst gebannt. Der Niederschlag der letzten Tage hat das Risiko deutlich gesenkt. Die Regenmengen waren bislang aber zu gering, um die anhaltende Trockenheit nachhaltig zu lindern.",https://wien.orf.at/stories/3354393/,https://ibs.orf.at/wie?image=https%3A%2F%2Foekastatic.orf.at%2Fmims%2F2021%2F30%2F64%2Fcrops%2Fw%3D1200%2Ch%3D627%2Cq%3D75%2F1016957_master_359064_210712_urwald_lainzer_tiergarten_hassler_00_00_37_11.jpg%3Fs%3Ddd3d5b2feceaebc8c27b53ec9f01042bc1361d00,,In Wien hat es in den vergangenen Tagen zwischen 30 und 70 Liter pro Quadratmeter geregnet. Nach einem trockenen Herbst und Winter hat der Regen der vergangenen Tage vorerst für eine Atempause gesorg… [+1533 chars],,"Waldbrandgefahr vorerst gebannt. Die Waldbrandgefahr ist vorerst gebannt. Der Niederschlag der letzten Tage hat das Risiko deutlich gesenkt. Die Regenmengen waren bislang aber zu gering, um die anhaltende Trockenheit nachhaltig zu lindern.","Forest fire risk averted for now. The danger of forest fires has been averted for the time being. The rainfall of the last few days has significantly reduced the risk. However, the amount of rain has so far been too low to provide lasting relief from the ongoing drought.",Silvarum incendium periculo nunc avertitur. Periculum incendium silvarum tantisper remotum est. Pluuia postremorum dierum periculum signanter redegit. Sed moles pluviae hactenus nimis humilis fuit ut subsidio diuturno siccitatis permanenti provideatur.,2026-05-18 12:01:08+00:00
13c3005fb4a85a85f9e23cd99553d7c0,2026-05-15T10:02:44Z,'Pegelstände Dauerregen',www.faz.net,de,0.3,22. Buchmesse Thessaloniki: Wie große Literatur in kleinen Ländern entsteht,In Thessaloniki werden die literarischen Chancen kleiner Staaten in einer großen Welt diskutiert. Der Ehrengast Bulgarien und das „spanische Phänomen“ sind Vorbilder. Auch deutsche Literaten sind anwesend.,https://www.faz.net/aktuell/feuilleton/buecher/buchmesse-thessaloniki-grosse-literatur-in-kleinen-laendern-accg-200834595.html,https://media0.faz.net/image/w1200h627/ffc3f6122d35/w6240h3260x0y450o/202605/32fc72cc-299c-4704-acef-31fe90bfc627/mit-valentin-groebners.webp,http://web.archive.org/web/20260517080818/https://www.faz.net/aktuell/feuilleton/buecher/buchmesse-thessaloniki-grosse-literatur-in-kleinen-laendern-accg-200834595.html,"Optimales Reisewetter sind der zugezogene Himmel und der Dauerregen von Thessaloniki nicht. Touristen bekommt man folglich kaum zu Gesicht. Dass es sich rund um das Messegelände trotzdem füllt, hat d… [+591 chars]",,22. Buchmesse Thessaloniki: Wie große Literatur in kleinen Ländern entsteht. In Thessaloniki werden die literarischen Chancen kleiner Staaten in einer großen Welt diskutiert. Der Ehrengast Bulgarien und das „spanische Phänomen“ sind Vorbilder. Auch deutsche Literaten sind anwesend.,22nd Thessaloniki Book Fair: How great literature is created in small countries. The literary opportunities of small states in a big world will be discussed in Thessaloniki. The guest of honor Bulgaria and the “Spanish phenomenon” are role models. German writers are also present.,"22 Thessalonica Liber Pulcher: Quam magnae litterae creantur in parvis regionibus. Occasiones litterariae parvarum civitatum in magno mundo Thessalonica disputabuntur. Hospes honoris Bulgariae et ""Hispanice phaenomenon"" munus exempla sunt. Adsunt etiam scriptores germanici.",2026-05-19 21:56:54+00:00
b2915a059bb06bbf6934960819e7304c,2026-05-05T04:32:07Z,'Dauerregen',www.stern.de,de,0.9,Wettervorhersage: Gewitter und Dauerregen - das Wetter in NRW,Essen (lnw) - In Nordrhein-Westfalen müssen sich die Menschen auf regnerische Tage einstellen. Nach Angaben des Deutschen Wetterdienstes (DWD) wird die,https://www.stern.de/gesellschaft/regional/nordrhein-westfalen/wettervorhersage--gewitter-und-dauerregen---das-wetter-in-nrw-37368560.html,https://image.stern.de/37368562/t/OF/v1/w1440/r1.7778/-/05--u3e2o6nxbmv3axs2048jpeg---b0ae6f87a01e26bc.jpg,http://web.archive.org/web/20260506103720/https://www.stern.de/gesellschaft/regional/nordrhein-westfalen/wettervorhersage--gewitter-und-dauerregen---das-wetter-in-nrw-37368560.html,"Kopiere den aktuellen Link
Zur Merkliste hinzufügen
In Nordrhein-Westfalen drohen von heute an kräftige Gewitter und Starkregen. Auch die nächsten Tage werden ungemütlich und nass.
In Nordrhein-We… [+1150 chars]",,Wettervorhersage: Gewitter und Dauerregen - das Wetter in NRW. Essen (lnw) - In Nordrhein-Westfalen müssen sich die Menschen auf regnerische Tage einstellen. Nach Angaben des Deutschen Wetterdienstes (DWD) wird die,"Weather forecast: Thunderstorms and continuous rain - the weather in NRW. Essen (lnw) - In North Rhine-Westphalia, people have to prepare for rainy days. According to the German Weather Service (DWD), the","Tempestas praenuntiet: Tempestates et imbres continuus - tempestas in NRW. Essen (lnw) — In septentrionali Rheno-Westphaliae homines ad tempus pluviosum parant. Secundum German Tempestas Service (DWD), the",2026-05-19 21:56:54+00:00
5e566bb9402b47ff048b6ba9c8491e5a,2026-05-11T04:40:39Z,'Dauerregen',www.zeit.de,de,0.9,Wetter: Eisheiligen beginnen mit Dauerregen im Schwarzwald,Hier finden Sie Informationen zu dem Thema „Wetter“. Lesen Sie jetzt „Eisheiligen beginnen mit Dauerregen im Schwarzwald“.,https://www.zeit.de/news/2026-05/11/eisheiligen-beginnen-mit-dauerregen-im-schwarzwald,https://img.zeit.de/news/2026-05/11/eisheiligen-beginnen-mit-dauerregen-im-schwarzwald-image-group/wide__1300x731,http://web.archive.org/web/20260511175233/https://www.zeit.de/news/2026-05/11/eisheiligen-beginnen-mit-dauerregen-im-schwarzwald,"In der neuen Woche stehen laut Kalender die Eisheiligen wieder an. Wie warm oder kalt es dann wird, muss sich aber erst noch zeigen. Sicher ist: Wer zum Wochenstart in Baden-Württemberg raus will, so… [+2081 chars]",,Wetter: Eisheiligen beginnen mit Dauerregen im Schwarzwald. Hier finden Sie Informationen zu dem Thema „Wetter“. Lesen Sie jetzt „Eisheiligen beginnen mit Dauerregen im Schwarzwald“.,Weather: Ice Saints start with continuous rain in the Black Forest. Here you will find information on the topic of “weather”. Now read “Ice Saints begin with constant rain in the Black Forest”.,"Tempestas: Sancti glacies incipiunt cum pluvia continua in Silva Nigra. Hic informationes invenies in argumento ""tempestatis"". Nunc legitur ""Sancti glacies in Nigra Silva assidua incipiunt pluvia"".",2026-05-19 21:56:54+00:00
75f341a4aea11e6c8bcf6511d4db3a69,2026-05-11T04:40:39Z,'Dauerregen',www.stern.de,de,0.9,Wetter: Eisheiligen beginnen mit Dauerregen im Schwarzwald,"Regenschirm zwecklos: Im Schwarzwald prasselt der Dauerregen, während Windböen durchs Land fegen. Am Mittwoch gibt’s eine Verschnaufpause – aber wie lange hält sie?",https://www.stern.de/gesellschaft/regional/baden-wuerttemberg/wetter--eisheiligen-beginnen-mit-dauerregen-im-schwarzwald-37386550.html,https://image.stern.de/37386552/t/ea/v1/w1440/r1.7778/-/11--dspzu345l6v7axs2048jpeg---ed1899201c70b0d6.jpg,,"Kopiere den aktuellen Link
Zur Merkliste hinzufügen
Regenschirm zwecklos: Im Schwarzwald prasselt der Dauerregen, während Windböen durchs Land fegen. Am Mittwoch gibts eine Verschnaufpause aber wie… [+2259 chars]",,"Wetter: Eisheiligen beginnen mit Dauerregen im Schwarzwald. Regenschirm zwecklos: Im Schwarzwald prasselt der Dauerregen, während Windböen durchs Land fegen. Am Mittwoch gibt’s eine Verschnaufpause – aber wie lange hält sie?",Weather: Ice Saints start with continuous rain in the Black Forest. Umbrella useless: The Black Forest is pelting with constant rain while gusts of wind sweep through the country. There's a breather on Wednesday - but how long does it last?,"Tempestas: Sancti glacies incipiunt cum pluvia continua in Silva Nigra. Umbella inutilia: Nigra Silva assiduis iacit imbri, dum venti procellis per rura verrunt. Dies Mercurii spirans est - sed quam diu durat?",2026-05-19 21:56:54+00:00
a33285487f073d47410a966a91b49037,2026-05-10T05:49:38Z,'Extremwetter Regen',www.stern.de,de,0.3,Wettervorhersage: Wetterumschwung im Südwesten - Ab wann der Regen kommt,Auf Sonne folgt Regen. Die flächendeckenden Sonnenstunden in Baden-Württemberg sind angezählt. Bereits ab dem Nachmittag wird der erste Regen erwartet. Wie es in den kommenden Tagen weitergeht.,https://www.stern.de/gesellschaft/regional/baden-wuerttemberg/wettervorhersage--wetterumschwung-im-suedwesten---ab-wann-der-regen-kommt-37384800.html,https://image.stern.de/37384802/t/PW/v1/w1440/r1.7778/-/10--cqb4jz4c7mv6axs2048jpeg---9704fa07da246d5f.jpg,http://web.archive.org/web/20260510062423/https://www.stern.de/gesellschaft/regional/baden-wuerttemberg/wettervorhersage--wetterumschwung-im-suedwesten---ab-wann-der-regen-kommt-37384800.html,"Kopiere den aktuellen Link
Zur Merkliste hinzufügen
Auf Sonne folgt Regen. Die flächendeckenden Sonnenstunden in Baden-Württemberg sind angezählt. Bereits ab dem Nachmittag wird der erste Regen erw… [+1687 chars]",,Wettervorhersage: Wetterumschwung im Südwesten - Ab wann der Regen kommt. Auf Sonne folgt Regen. Die flächendeckenden Sonnenstunden in Baden-Württemberg sind angezählt. Bereits ab dem Nachmittag wird der erste Regen erwartet. Wie es in den kommenden Tagen weitergeht.,Weather forecast: Change in the weather in the southwest - when will the rain come? Rain follows sunshine. The extensive hours of sunshine in Baden-Württemberg are counted. The first rain is expected in the afternoon. What will happen in the coming days.,Tempestas praenuntientur: Mutata tempestas in africum - quando pluvia veniet? Imber sequitur sole. Magnae soles in Baden-Württemberg horae numerantur. Prima pluvia post meridiem expectatur. Quid fiet in diebus venturis.,2026-05-20 22:12:23+00:00
6bac5cf5edb07dbc30a66ee969ea9c53,2026-05-10T05:49:38Z,'Extremwetter Regen',www.zeit.de,de,0.3,Wettervorhersage: Wetterumschwung im Südwesten - Ab wann der Regen kommt,Hier finden Sie Informationen zu dem Thema „Wettervorhersage“. Lesen Sie jetzt „Wetterumschwung im Südwesten - Ab wann der Regen kommt“.,https://www.zeit.de/news/2026-05/10/wetterumschwung-im-suedwesten-ab-wann-der-regen-kommt,https://img.zeit.de/news/2026-05/10/wetterumschwung-im-suedwesten-ab-wann-der-regen-kommt-image-group/wide__1300x731,,"Noch einmal können die Menschen im Südwesten die Sonne genießen, bevor es zum Wochenstart nass und grau wird. Am Vormittag erwartet der Deutsche Wetterdienst (DWD) noch heiteres Wetter. Im Verlauf de… [+1476 chars]",,Wettervorhersage: Wetterumschwung im Südwesten - Ab wann der Regen kommt. Hier finden Sie Informationen zu dem Thema „Wettervorhersage“. Lesen Sie jetzt „Wetterumschwung im Südwesten - Ab wann der Regen kommt“.,Weather forecast: Change in the weather in the southwest - when will the rain come? Here you will find information on the subject of “weather forecast”. Now read “Change in the weather in the southwest – when will the rain come?”,"Tempestas praenuntientur: Mutata tempestas in africum - quando pluvia veniet? Hic invenies informationes de re ""tempestatis praenuntientur"". Nunc legitur ""Mutare tempestatem in africum - quando pluvia veniet?""",2026-05-20 22:12:23+00:00
2909b6ff4ae0706aec2256403221295e,2026-05-10T08:12:51Z,'Extremwetter Regen',www.stern.de,de,0.3,Aussichten: Wetter in Niedersachsen: Neue Woche startet windig und kühl,Hannover/ Bremen (lni) - Nach einem milden Wochenende müssen sich die Menschen in Niedersachsen in den kommenden Tagen auf niedrigere Temperaturen und,https://www.stern.de/gesellschaft/regional/niedersachsen-bremen/aussichten--wetter-in-niedersachsen--neue-woche-startet-windig-und-kuehl-37385002.html,https://image.stern.de/37385004/t/ll/v1/w1440/r1.7778/-/10--yqisnjou3iv10axs2048jpeg---c6ba69cbf6c74c93.jpg,http://web.archive.org/web/20260511075538/https://www.stern.de/gesellschaft/regional/niedersachsen-bremen/aussichten--wetter-in-niedersachsen--neue-woche-startet-windig-und-kuehl-37385002.html,"Kopiere den aktuellen Link
Zur Merkliste hinzufügen
Nach milden Tagen folgt in Niedersachsen ein wechselhafter und kühler Wochenbeginn. Regen ist ebenfalls angekündigt.
Nach einem milden Wochenend… [+2134 chars]",,Aussichten: Wetter in Niedersachsen: Neue Woche startet windig und kühl. Hannover/ Bremen (lni) - Nach einem milden Wochenende müssen sich die Menschen in Niedersachsen in den kommenden Tagen auf niedrigere Temperaturen und,"Outlook: Weather in Lower Saxony: The new week starts windy and cool. Hanover/Bremen (lni) - After a mild weekend, people in Lower Saxony will have to prepare for lower temperatures and temperatures in the coming days","Prospectus: Tempestas in Saxonia inferiori: Novus dies sabbati incipit ventosus et frigidus. Hanover/Bremen (lni) - Post leni volutpat, homines in Saxonia inferiori debebunt temperaturas et temperaturas in proximis diebus praeparare.",2026-05-20 22:12:23+00:00
aedadbae3efc63dfeabf73be30cfadab,2026-05-10T08:12:51Z,'Dauerregen',www.zeit.de,de,0.3,Aussichten: Wetter in Niedersachsen: Neue Woche startet windig und kühl,Hier finden Sie Informationen zu dem Thema „Aussichten“. Lesen Sie jetzt „Wetter in Niedersachsen: Neue Woche startet windig und kühl“.,https://www.zeit.de/news/2026-05/10/wetter-in-niedersachsen-neue-woche-startet-windig-und-kuehl,https://img.zeit.de/news/2026-05/10/wetter-in-niedersachsen-neue-woche-startet-windig-und-kuehl-image-group/wide__1300x731,http://web.archive.org/web/20260511175326/https://www.zeit.de/news/2026-05/10/wetter-in-niedersachsen-neue-woche-startet-windig-und-kuehl,"Nach einem milden Wochenende müssen sich die Menschen in Niedersachsen in den kommenden Tagen auf niedrigere Temperaturen und Regen einstellen. Wie der Deutsche Wetterdienst (DWD) mitteilte, strömt i… [+2001 chars]",,Aussichten: Wetter in Niedersachsen: Neue Woche startet windig und kühl. Hier finden Sie Informationen zu dem Thema „Aussichten“. Lesen Sie jetzt „Wetter in Niedersachsen: Neue Woche startet windig und kühl“.,Outlook: Weather in Lower Saxony: The new week starts windy and cool. Here you will find information on the topic of “Prospects”. Now read “Weather in Lower Saxony: New week starts windy and cool”.,"Prospectus: Tempestas in Saxonia inferiori: Novus dies sabbati incipit ventosus et frigidus. Hic informationes invenies in argumento ""Prospectorum"". Nunc legitur ""Tempestas in Saxonia inferiori: Nova septimana incipit ventosus et frigidus"".",2026-05-20 22:12:23+00:00
3ca5547571274b08750cb780834137e4,2026-05-14T05:20:39Z,'Starkregen',www.zeit.de,de,0.3,Wetter: Feiertag fällt ins Wasser - Sonne erst am Sonntag,Hier finden Sie Informationen zu dem Thema „Wetter“. Lesen Sie jetzt „Feiertag fällt ins Wasser - Sonne erst am Sonntag“.,https://www.zeit.de/news/2026-05/14/feiertag-faellt-ins-wasser-sonne-erst-am-sonntag,https://img.zeit.de/news/2026-05/14/feiertag-faellt-ins-wasser-sonne-erst-am-sonntag-image-group/wide__1300x731,http://web.archive.org/web/20260514075626/https://www.zeit.de/news/2026-05/14/feiertag-faellt-ins-wasser-sonne-erst-am-sonntag,Regenschirm und eine zusätzliche Schicht Kleidung dürften in Baden-Württemberg in den nächsten Tagen gute Begleiter sein: Der Vorhersage des Deutschen Wetterdienstes (DWD) zufolge bleibt es bis Samst… [+1367 chars],,Wetter: Feiertag fällt ins Wasser - Sonne erst am Sonntag. Hier finden Sie Informationen zu dem Thema „Wetter“. Lesen Sie jetzt „Feiertag fällt ins Wasser - Sonne erst am Sonntag“.,Weather: Holiday falls through - sun only on Sunday. Here you will find information on the topic of “weather”. Now read “Holiday falls through - sun only on Sunday”.,"Tempestas: Feriae per - Solem tantum die Dominico. Hic informationes invenies in argumento ""tempestatis"". Nunc legitur ""Festus per solem cadit tantum die dominico"".",2026-05-21 22:04:09+00:00
fb096dcad50143db9379f31000482938,2026-05-15T04:28:44Z,'Starkregen',www.stern.de,de,0.3,"Wetter: Regen, Wind und Frost - wo es Schneeflocken geben könnte","Stuttgart (lsw) - Vor dem Wochenende präsentiert sich das Wetter grau, nass und kühl bis kalt: Heute stark bewölkt mit Schauern, ab dem Nachmittag auch",https://www.stern.de/gesellschaft/regional/baden-wuerttemberg/wetter--regen--wind-und-frost---wo-es-schneeflocken-geben-koennte-37399026.html,https://image.stern.de/37399028/t/RA/v1/w1440/r1.7778/-/15--ttoyssuznbv4axs2048jpeg---a346828b05fa83b2.jpg,http://web.archive.org/web/20260515060648/https://www.stern.de/gesellschaft/regional/baden-wuerttemberg/wetter--regen--wind-und-frost---wo-es-schneeflocken-geben-koennte-37399026.html,"Kopiere den aktuellen Link
Zur Merkliste hinzufügen
Mitte Mai präsentiert sich das Wetter wenig frühlingshaft. Wie sich die Temperaturen entwickeln und wo es Schneeflocken geben könnte.
Vor dem Wo… [+1351 chars]",,"Wetter: Regen, Wind und Frost - wo es Schneeflocken geben könnte. Stuttgart (lsw) - Vor dem Wochenende präsentiert sich das Wetter grau, nass und kühl bis kalt: Heute stark bewölkt mit Schauern, ab dem Nachmittag auch","Weather: Rain, wind and frost - where there could be snowflakes. Stuttgart (lsw) - Before the weekend the weather is grey, wet and cool to cold: today very cloudy with showers, from the afternoon onwards too","Tempestas: Pluvia, ventus et gelu - ubi nivis esse potuerunt. Stuttgart (lsw) - Tempestas ante volutpat est griseus, humidus et frigidus ad frigus: hodie valde nubilus cum imbribus, post meridiem nimis",2026-05-21 22:04:09+00:00
6f3b67f02593d135ea719fb9079cef80,2026-05-15T04:28:44Z,'Entsiegelung Regen',www.zeit.de,de,0.3,"Wetter: Regen, Wind und Frost - wo es Schneeflocken geben könnte","Hier finden Sie Informationen zu dem Thema „Wetter“. Lesen Sie jetzt „Regen, Wind und Frost - wo es Schneeflocken geben könnte“.",https://www.zeit.de/news/2026-05/15/regen-wind-und-frost-wo-es-schneeflocken-geben-koennte,https://img.zeit.de/news/2026-05/15/regen-wind-und-frost-wo-es-schneeflocken-geben-koennte-image-group/wide__1300x731,,"Vor dem Wochenende präsentiert sich das Wetter grau, nass und kühl bis kalt: Heute stark bewölkt mit Schauern, ab dem Nachmittag auch kurzen Gewittern mit vereinzeltem Starkregen, Windböen und kleine… [+1201 chars]",,"Wetter: Regen, Wind und Frost - wo es Schneeflocken geben könnte. Hier finden Sie Informationen zu dem Thema „Wetter“. Lesen Sie jetzt „Regen, Wind und Frost - wo es Schneeflocken geben könnte“.","Weather: Rain, wind and frost - where there could be snowflakes. Here you will find information on the topic of “weather”. Now read “Rain, wind and frost - where there could be snowflakes”.","Tempestas: Pluvia, ventus et gelu - ubi nivis esse potuerunt. Hic informationes invenies in argumento ""tempestatis"". Nunc lege ""imber, ventus et gelu - ubi nives esse possunt"".",2026-05-21 22:04:09+00:00
adae1dd95271c2b97c214c1a67a10e2f,2026-05-15T09:55:24Z,'Entsiegelung Regen',kaernten.orf.at,de,0.3,Trotz Regens: Kein Brand aus im Lesachtal,"Trotz der Niederschläge, Freitagfrüh in Form von Schnee, auf der Simonhöhe, in Bad Bleiberg aber auch im Lesachtal, gibt es für das Feuer in Lesachtal (Bezirk Hermagor) noch immer kein „Brand aus“. Bei dem größten Waldbrand seit Jahrzehnten in Kärnten setzen …",https://kaernten.orf.at/stories/3354306/,https://ibs.orf.at/ktn?image=https%3A%2F%2Foekastatic.orf.at%2Fmims%2F2026%2F18%2F69%2Fcrops%2Fw%3D1200%2Ch%3D627%2Cq%3D75%2F3018578_master_1167769_koppensteiner_robert_2.jpg%3Fs%3D1aaee60e4b8e75f33a366a159a791e39a84bff1b,,"In Lesachtal hat sich eine dünne Schneedecke auf die 110 Hektar aschebedeckten Boden gelegt. Schnee ist in so einem Fall ideal, denn das Wasser dringt damit langsam in den Boden ein, es ist die beste… [+1198 chars]",,"Trotz Regens: Kein Brand aus im Lesachtal. Trotz der Niederschläge, Freitagfrüh in Form von Schnee, auf der Simonhöhe, in Bad Bleiberg aber auch im Lesachtal, gibt es für das Feuer in Lesachtal (Bezirk Hermagor) noch immer kein „Brand aus“. Bei dem größten Waldbrand seit Jahrzehnten in Kärnten setzen …","Despite the rain: No fire in the Lesachtal. Despite the precipitation, Friday morning in the form of snow, on the Simonhöhe, in Bad Bleiberg but also in the Lesachtal, there is still no “fire out” for the fire in Lesachtal (Hermagor district). During the largest forest fire in decades in Carinthia...","Quamvis pluvia: Nullus ignis in Lesachtal. Quamvis praecipitatio, mane Veneris in forma nivis, in Simonhohe, in Bad Bleiberg, sed etiam in Lesachtal, adhuc ignis in Lesachtal (Hrmagor regio) non est ""ignis"". Per maximum incendium silvestre in decenniis in Carinthia...",2026-05-21 22:04:09+00:00
