index,published,keyword,domain,language,valid,title,description,url,image,archive,content,quote,de,en,la,added
65785500a96d6e8d9ae62db1bd43040e,2026-07-01T09:23:41Z,'Unwetterwarnung',www.zeit.de,de,0.9,Warnung vor Sturm und Hagel: Abfertigungsstopp am Münchner Flughafen nach Unwetterwarnung,Hier finden Sie Informationen zu dem Thema „Warnung vor Sturm und Hagel“. Lesen Sie jetzt „Abfertigungsstopp am Münchner Flughafen nach Unwetterwarnung“.,https://www.zeit.de/news/2026-07/01/abfertigungsstopp-am-muenchner-flughafen-nach-unwetterwarnung,https://img.zeit.de/news/2026-07/01/abfertigungsstopp-am-muenchner-flughafen-nach-unwetterwarnung-image-group/wide__1300x731,,"Wegen einer Unwetterwarnung werden am Münchner Flughafen vorerst keine Maschinen abgefertigt. Der Abfertigungsbetrieb sei vorerst eingestellt, teilte der Flughafen per Durchsage vor Ort mit. 
Aufgru… [+415 chars]",,Warnung vor Sturm und Hagel: Abfertigungsstopp am Münchner Flughafen nach Unwetterwarnung. Hier finden Sie Informationen zu dem Thema „Warnung vor Sturm und Hagel“. Lesen Sie jetzt „Abfertigungsstopp am Münchner Flughafen nach Unwetterwarnung“.,Warning of storms and hail: check-in stop at Munich Airport after a severe weather warning. Here you will find information on the topic “Warning about storms and hail”. Now read “Check-in stop at Munich Airport after severe weather warning”.,"Monitum procellarum et grandinum: perscriptio in statione apud Airport Munich post tempestatem gravem admonitionem. Hic informationes invenies in themate ""Admonitio de procellis et grandinibus"". Nunc legitur ""Reprehendo-in statur apud Munich Airport post tempestatem gravem admonitionem"".",2026-07-03 06:49:16+00:00
a56a5b9f861cb74a9441a1b730596a17,2026-07-01T09:24:50Z,'Unwetterwarnung',www.tagesspiegel.de,de,0.9,Wetter: Abfertigungsstopp am Münchner Flughafen nach Unwetterwarnung,Seit Tagen ziehen immer wieder teils schwere Gewitter über Bayern. Am Münchner Flughafen wurden nun Maschinen ausgebremst.,https://www.tagesspiegel.de/gesellschaft/panorama/wetter-abfertigungsstopp-am-munchner-flughafen-nach-unwetterwarnung-15780952.html,https://www.tagesspiegel.de/images/15781444/alternates/BASE_16_9_W1400/1782902506000/abfertigungsstopp-am-munchner-flughafen-nach-unwetterwarnung.jpeg,http://web.archive.org/web/20260702074454/https://www.tagesspiegel.de/gesellschaft/panorama/wetter-abfertigungsstopp-am-munchner-flughafen-nach-unwetterwarnung-15780952.html,"Nach einer Unwetterwarnung sind am Münchner Flughafen am Vormittag zeitweise keine Maschinen abgefertigt worden. Wegen der Wetterlage sei für 30 Minuten ein Abfertigungsstopp ausgerufen worden, teilt… [+916 chars]",,Wetter: Abfertigungsstopp am Münchner Flughafen nach Unwetterwarnung. Seit Tagen ziehen immer wieder teils schwere Gewitter über Bayern. Am Münchner Flughafen wurden nun Maschinen ausgebremst.,Weather: Check-in stop at Munich airport after severe weather warning. Severe thunderstorms have been raging across Bavaria for days. Machines have now been slowed down at Munich Airport.,Tempestas: Check-in stop ad aeroportus Monacensis cum gravibus tempestatibus admonitio. Gravibus tonitribus trans Bavariam diebus saeviebant. Machinae nunc apud Airport Munich retardatae sunt.,2026-07-03 06:49:16+00:00
894dda3f7b2b474d12157372118959de,2026-07-01T09:24:50Z,'Unwetterwarnung',www.tagesspiegel.de,de,0.9,Warnung vor Sturm und Hagel: Abfertigungsstopp am Münchner Flughafen nach Unwetterwarnung,Seit Tagen ziehen immer wieder teils schwere Gewitter über Bayern. Wegen einer Unwetterwarnung werden jetzt auch Maschinen am Münchner Flughafen ausgebremst.,https://www.tagesspiegel.de/gesellschaft/panorama/warnung-vor-sturm-und-hagel-abfertigungsstopp-am-munchner-flughafen-nach-unwetterwarnung-15780952.html,https://www.tagesspiegel.de/images/15780951/alternates/BASE_16_9_W1400/1782897890000/munchner-flughafen.jpeg,,"Wegen einer Unwetterwarnung werden am Münchner Flughafen vorerst keine Maschinen abgefertigt. Der Abfertigungsbetrieb sei vorerst eingestellt, teilte der Flughafen per Durchsage vor Ort mit. 
Aufgru… [+469 chars]",,Warnung vor Sturm und Hagel: Abfertigungsstopp am Münchner Flughafen nach Unwetterwarnung. Seit Tagen ziehen immer wieder teils schwere Gewitter über Bayern. Wegen einer Unwetterwarnung werden jetzt auch Maschinen am Münchner Flughafen ausgebremst.,"Warning of storms and hail: check-in stop at Munich Airport after a severe weather warning. Severe thunderstorms have been raging across Bavaria for days. Due to a severe weather warning, machines at Munich Airport are now also being slowed down.","Monitum procellarum et grandinum: perscriptio in statione apud Airport Munich post tempestatem gravem admonitionem. Gravibus tonitribus trans Bavariam diebus saeviebant. Ob tempestatem gravem monendo, machinae apud Airport Munich etiam nunc retardatae sunt.",2026-07-03 06:49:16+00:00
9094bd6d85a820cea3a9cbe9dafc5b56,2026-07-01T09:39:34Z,'Unwetterwarnung',www.sueddeutsche.de,de,0.9,Sturm und Hagel: Abfertigungsstopp am Münchner Flughafen nach Unwetterwarnung,Seit Tagen ziehen immer wieder teils schwere Gewitter über Bayern. Wegen einer Unwetterwarnung werden jetzt auch Maschinen am Münchner Flughafen ausgebremst.,https://www.sueddeutsche.de/muenchen/flughafen-muenchen-unwetter-abfertigung-stopp-li.3508560,https://www.sueddeutsche.de/2026/07/01/9b785ce2-8063-49b9-a731-469777b3069b.jpg?q=60&fm=webp&width=1200&rect=0%2C205%2C4000%2C2250,,"Wegen einer Unwetterwarnung werden am Münchner Flughafen vorerst keine Maschinen abgefertigt. Der Abfertigungsbetrieb sei vorerst eingestellt, teilte der Flughafen per Durchsage vor Ort mit.Aufgrund … [+368 chars]",,Sturm und Hagel: Abfertigungsstopp am Münchner Flughafen nach Unwetterwarnung. Seit Tagen ziehen immer wieder teils schwere Gewitter über Bayern. Wegen einer Unwetterwarnung werden jetzt auch Maschinen am Münchner Flughafen ausgebremst.,"Storm and hail: check-in stop at Munich airport after severe weather warning. Severe thunderstorms have been raging across Bavaria for days. Due to a severe weather warning, machines at Munich Airport are now also being slowed down.","Tempestas et grando: in aeroportus Monacensis apud moras-reprehendo post tempestatem gravem admonitionem. Gravibus tonitribus trans Bavariam diebus saeviebant. Ob tempestatem gravem monendo, machinae apud Airport Munich etiam nunc retardatae sunt.",2026-07-03 06:49:16+00:00
fa44d035b3ce80fd14c2091ff075daaa,2026-07-01T17:00:48Z,'Unwetterwarnung',www.morgenpost.de,de,0.9,Unwetterwarnung kurz vor Foo-Fighters-Konzert in Berlin – Beginn unklar,"Kurz vor dem geplanten Auftritt um 19 Uhr wird vor Unwetter gewarnt. Wann das Konzert starten kann, ist noch offen. News im Blog.",https://www.morgenpost.de/berlin/article412346994/wetter-berlin-aktuell-news-warnungen-gewitter-unwetter-foo-fighters-olympiastadion.html,https://img.sparknews.funkemedien.de/412454875/412454875_1782925286_v16_9_1600.jpeg,,Stresstest für Straßen: Neben den erheblichen Hitzeschäden auf Autobahnen waren auch Landesstraßen in Brandenburg betroffen. Die Straßenmeistereien waren laut Verkehrsministerium auf die extremen Tem… [+1430 chars],,"Unwetterwarnung kurz vor Foo-Fighters-Konzert in Berlin – Beginn unklar. Kurz vor dem geplanten Auftritt um 19 Uhr wird vor Unwetter gewarnt. Wann das Konzert starten kann, ist noch offen. News im Blog.",Storm warning shortly before the Foo Fighters concert in Berlin - beginning unclear. Shortly before the planned performance at 7 p.m. there is a warning about severe weather. It is still unclear when the concert can start. News in the blog.,Tempestas monitum paulo ante Foo Pugnatores concentus Berolinensi - initium latens est. Paulo ante ad VII a.m. cavetur de tempestatibus gravibus. Incertum est adhuc quando concentus incipere potest. News in diario.,2026-07-03 06:49:16+00:00
f63629317b66997c0d2fd545afa48ffc,2026-07-01T22:49:53Z,'Unwetterwarnung',www.morgenpost.de,de,0.9,Die Foo Fighters rocken im Olympiastadion das Gewitter weg,Die Show von Dave Grohl und seiner Band stand zwischendurch wegen einer Unwetterwarnung auf der Kippe. Dann wurde es ein heißer Abend.,https://www.morgenpost.de/kultur/article412447497/die-foo-fighters-rocken-im-olympiastadion-das-gewitter-weg.html,https://img.sparknews.funkemedien.de/412447358/412447358_1782945494_v16_9_1600.jpeg,,"Eine dichte rote Nebelwand versperrt im Berliner Olympiastadion die Sicht auf die Bühne. Es sind am Mittwochabend aber keine Hertha-Hools, die gezündelt haben. Die großzügig gezündete Pyrotechnik mar… [+3359 chars]",,Die Foo Fighters rocken im Olympiastadion das Gewitter weg. Die Show von Dave Grohl und seiner Band stand zwischendurch wegen einer Unwetterwarnung auf der Kippe. Dann wurde es ein heißer Abend.,The Foo Fighters rock the storm in the Olympic Stadium. Dave Grohl and his band's show was temporarily canceled due to a severe weather warning. Then it became a hot evening.,Foo Pugnatores tempestas in Stadio Olympico lapis. Dave Grohl et spectaculum cohortis eius ad tempus remissum est propter magnam tempestatem admonitionem. Tunc incalescit vespera.,2026-07-03 06:49:16+00:00
