index,published,keyword,domain,language,valid,title,description,url,image,archive,content,quote,de,en,la,added
a41daae9f55f499cc23dd8b244572e65,2026-06-02T15:57:28Z,'Starkregen',www.stern.de,de,0.9,Wetter: Unwetterwarnung vor schweren Gewittern und Starkregen,Stuttgart/Ulm (lsw) - Der Deutsche Wetterdienst (DWD) warnt aktuell vor schweren Gewittern und heftigem Starkregen in den Regierungsbezirken Stuttgart und,https://www.stern.de/gesellschaft/regional/baden-wuerttemberg/wetter--unwetterwarnung-vor-schweren-gewittern-und-starkregen-37483180.html,https://image.stern.de/37483182/t/v0/v1/w1440/r1.7778/-/02--opfmukwkezv2axs2048jpeg---9b1ac73156859e11.jpg,,"Kopiere den aktuellen Link
Zur Merkliste hinzufügen
Blitzschlag, Hagel, Sturmböen: Der Deutsche Wetterdienst sagt Unwetter vorher. Welche Regionen besonders betroffen sind.
Der Deutsche Wetterdien… [+739 chars]",,Wetter: Unwetterwarnung vor schweren Gewittern und Starkregen. Stuttgart/Ulm (lsw) - Der Deutsche Wetterdienst (DWD) warnt aktuell vor schweren Gewittern und heftigem Starkregen in den Regierungsbezirken Stuttgart und,Weather: Severe weather warning for severe thunderstorms and heavy rain. Stuttgart/Ulm (lsw) - The German Weather Service (DWD) is currently warning of severe thunderstorms and heavy rain in the administrative districts of Stuttgart and,Weather: asperae tempestatis monitae sunt graves tonitribus et pluviae graves. Stuttgart/Ulm (lsw) - Tempestas Service Germanica (DWD) in praesenti monitus est de gravibus procellis et gravibus pluviae in regionibus administrativis Stuttgartensibus ac,2026-06-03 22:39:30+00:00
e85d44a16c2c05a16b70dd4a23e68caa,2026-06-02T15:57:28Z,'Unwetterwarnung',www.zeit.de,de,0.9,Wetter: Unwetterwarnung vor schweren Gewittern und Starkregen,Hier finden Sie Informationen zu dem Thema „Wetter“. Lesen Sie jetzt „Unwetterwarnung vor schweren Gewittern und Starkregen“.,https://www.zeit.de/news/2026-06/02/unwetterwarnung-vor-schweren-gewittern-und-starkregen,https://img.zeit.de/news/2026-06/02/unwetterwarnung-vor-schweren-gewittern-und-starkregen-image-group/wide__1300x731,,Der Deutsche Wetterdienst (DWD) warnt aktuell vor schweren Gewittern und heftigem Starkregen in den Regierungsbezirken Stuttgart und Tübingen. Laut einer Karte auf der Internetseite des DWD gilt beso… [+607 chars],,Wetter: Unwetterwarnung vor schweren Gewittern und Starkregen. Hier finden Sie Informationen zu dem Thema „Wetter“. Lesen Sie jetzt „Unwetterwarnung vor schweren Gewittern und Starkregen“.,Weather: Severe weather warning for severe thunderstorms and heavy rain. Here you will find information on the topic of “weather”. Now read “Severe weather warning for severe thunderstorms and heavy rain”.,"Weather: asperae tempestatis monitae sunt graves tonitribus et pluviae graves. Hic informationes invenies in argumento ""tempestatis"". Nunc lege ""Tempestas gravis tonitribus gravibusque pluviis monitum"".",2026-06-03 22:39:30+00:00
dc5aa75c682cc17c520c57700d3ba96c,2026-06-02T16:41:23Z,'Unwetterwarnung',www.stern.de,de,0.9,Wetter: Unwetterwarnung im Südwesten aufgehoben,Stuttgart/Heidenheim (lsw) - Nach knapp einer Stunde hat der Deutsche Wetterdienst (DWD) eine Unwetterwarnung vor schwerem Gewitter in Teilen,https://www.stern.de/gesellschaft/regional/baden-wuerttemberg/wetter--unwetterwarnung-im-suedwesten-aufgehoben-37483180.html,https://image.stern.de/37483324/t/Dl/v1/w1440/r1.7778/-/02--cnhbbdlo2rv4axs2048jpeg---5bf11dfc483cfc11.jpg,,"Kopiere den aktuellen Link
Zur Merkliste hinzufügen
Blitzschlag, Hagel, Sturmböen: Der Deutsche Wetterdienst hat Unwetter vorhergesagt. Nach etwa einer Stunde folgt die Entwarnung.
Nach knapp eine… [+1002 chars]",,Wetter: Unwetterwarnung im Südwesten aufgehoben. Stuttgart/Heidenheim (lsw) - Nach knapp einer Stunde hat der Deutsche Wetterdienst (DWD) eine Unwetterwarnung vor schwerem Gewitter in Teilen,"Weather: Severe weather warning lifted in the southwest. Stuttgart/Heidenheim (lsw) - After almost an hour, the German Weather Service (DWD) issued a severe weather warning of severe thunderstorms in parts","Weather: saeva monitio in Africum. Stuttgart/Heidenheim (lsw) - Post horam fere, Servitium Tempestatis Germanicae (DWD) gravem tempestatem denuntiaverunt de gravibus tonitribus in partibus.",2026-06-03 22:39:30+00:00
37a463e037fd568c94c9d400adac2eb7,2026-06-02T15:21:57Z,'Starkregen',www.stern.de,de,0.9,Stürmisches Wetter: Starkregen bis 40 Liter - Große Unwettereinsätze bleiben aus,"Der Deutsche Wetterdienst hat in NRW kräftige Gewitter mit Starkregen und Hagel angekündigt, lokal bis zu 40 Liter Regen pro Quadratmeter. Von den Feuerwehren kamen keine Meldungen über Großeinsätze.",https://www.stern.de/gesellschaft/regional/nordrhein-westfalen/stuermisches-wetter--starkregen-bis-40-liter---grosse-unwettereinsaetze-bleiben-aus-37478558.html,https://image.stern.de/37482996/t/Oa/v1/w1440/r1.7778/-/02--qv32uuwt33v7axs2048jpeg---d4078f53a4880345.jpg,,"Kopiere den aktuellen Link
Zur Merkliste hinzufügen
Der Deutsche Wetterdienst hat in NRW kräftige Gewitter mit Starkregen und Hagel angekündigt, lokal bis zu 40 Liter Regen pro Quadratmeter. Von de… [+1082 chars]",,"Stürmisches Wetter: Starkregen bis 40 Liter - Große Unwettereinsätze bleiben aus. Der Deutsche Wetterdienst hat in NRW kräftige Gewitter mit Starkregen und Hagel angekündigt, lokal bis zu 40 Liter Regen pro Quadratmeter. Von den Feuerwehren kamen keine Meldungen über Großeinsätze.","Stormy weather: Heavy rain up to 40 liters - there are no major storms. The German Weather Service has announced strong thunderstorms with heavy rain and hail in North Rhine-Westphalia, locally up to 40 liters of rain per square meter. There were no reports of large-scale operations from the fire departments.","Tempestas turbulenta: Imber gravis usque ad 40 liters - nullae sunt maiores tempestates. Ministerium Tempestatis Germanicae cum pluvia et grandine in North Rheno-Westphalia valida tonitribus denuntiavit, localiter usque ad 40 liters pluviae per metrum quadratam. Nullae auditiones magnarum rerum ab incendiis departments erant.",2026-06-04 22:07:47+00:00
62c1902e41e252b7802ab2d380dc5850,2026-06-02T03:58:43Z,'Unwettergefahr',www.bild.de,de,0.9,Starkregen und Sturm im Anmarsch - Gewitterband teilt Deutschland in zwei Hälften,"Wetterexperten warnen vor einer Gewitterfront, die quer durch Deutschland fegt.",https://www.bild.de/news/wetter/gewitterband-teilt-deutschland-in-zwei-haelften-6a1d4d58411d40cd4c74e09d,"https://images.bild.de/6a1d4d58411d40cd4c74e09d/848d2682761f7ab41ab64e39710a85dd,7492f043?w=1280",http://web.archive.org/web/20260603094916/https://www.bild.de/news/wetter/gewitterband-teilt-deutschland-in-zwei-haelften-6a1d4d58411d40cd4c74e09d,TTS-Player überspringenArtikel weiterlesenDer meteorologische Sommerbeginn am 1. Juni ist vielerorts buchstäblich ins Wasser gefallen. Statt Sonne dominiert Regen das Bild und ein Ende ist nicht in S… [+3666 chars],,"Starkregen und Sturm im Anmarsch - Gewitterband teilt Deutschland in zwei Hälften. Wetterexperten warnen vor einer Gewitterfront, die quer durch Deutschland fegt.",Heavy rain and storms approaching - a band of thunderstorms divides Germany into two halves. Weather experts are warning of a thunderstorm front sweeping across Germany.,Imbribus gravibus ac procellis appropinquantibus Germaniam manus tonitribus in duas partes dividit. Tempestatis periti monent tonitrui ante Germaniam verrentes.,2026-06-05 11:45:06+00:00
b6859905242d11c7731166751af9db96,2026-06-02T04:06:52Z,'Unwettergefahr',www.zeit.de,de,0.9,Wettervorhersage: Unwettergefahr: Wo es heute besonders heftig werden kann,Hier finden Sie Informationen zu dem Thema „Wettervorhersage“. Lesen Sie jetzt „Unwettergefahr: Wo es heute besonders heftig werden kann“.,https://www.zeit.de/news/2026-06/02/unwettergefahr-wo-es-heute-besonders-heftig-werden-kann,https://img.zeit.de/news/2026-06/02/unwettergefahr-wo-es-heute-besonders-heftig-werden-kann-image-group/wide__1300x731,http://web.archive.org/web/20260603080616/https://www.zeit.de/news/2026-06/02/unwettergefahr-wo-es-heute-besonders-heftig-werden-kann,"Es könnte ungemütlich werden: Für Baden-Württemberg kündigt sich eine markante Gewitterlage an. Der Deutsche Wetterdienst (DWD) rechnet der Vorhersage zufolge für heute teils mit starken Gewittern, ö… [+806 chars]",,Wettervorhersage: Unwettergefahr: Wo es heute besonders heftig werden kann. Hier finden Sie Informationen zu dem Thema „Wettervorhersage“. Lesen Sie jetzt „Unwettergefahr: Wo es heute besonders heftig werden kann“.,Weather forecast: Danger of severe weather: Where it could be particularly severe today. Here you will find information on the subject of “weather forecast”. Now read “Danger of severe weather: Where it could be particularly severe today”.,"Tempestas praenuntiet: Periculum tempestatum gravium: Ubi hodie fieri potuit peculiariter gravis. Hic invenies informationes de re ""tempestatis praenuntientur"". Nunc legitur ""Periculum tempestatis gravis: Ubi hodie fieri potest gravius"".",2026-06-05 11:45:06+00:00
f49f271924daba3f727452b3e5883f07,2026-06-02T04:06:52Z,'Unwettergefahr',www.stern.de,de,0.9,Wettervorhersage: Unwettergefahr: Wo es heute besonders heftig werden kann,Stuttgart (lsw) - Es könnte ungemütlich werden: Für Baden-Württemberg kündigt sich eine markante Gewitterlage an. Der Deutsche Wetterdienst (DWD) rechnet,https://www.stern.de/gesellschaft/regional/baden-wuerttemberg/wettervorhersage--unwettergefahr--wo-es-heute-besonders-heftig-werden-kann-37478382.html,https://image.stern.de/37478384/t/3e/v1/w1440/r1.7778/-/02--45sbeitvcvv4axs2048jpeg---1073d92e2a26ebee.jpg,http://web.archive.org/web/20260602090659/https://www.stern.de/gesellschaft/regional/baden-wuerttemberg/wettervorhersage--unwettergefahr--wo-es-heute-besonders-heftig-werden-kann-37478382.html,"Kopiere den aktuellen Link
Zur Merkliste hinzufügen
Sturmböen, Starkregen und Hagel: Heute zieht eine Gewitterlinie über Baden-Württemberg. Wo es besonders heftig wird und wann die Sonne wieder rau… [+974 chars]",,Wettervorhersage: Unwettergefahr: Wo es heute besonders heftig werden kann. Stuttgart (lsw) - Es könnte ungemütlich werden: Für Baden-Württemberg kündigt sich eine markante Gewitterlage an. Der Deutsche Wetterdienst (DWD) rechnet,Weather forecast: Danger of severe weather: Where it could be particularly severe today. Stuttgart (lsw) - It could get uncomfortable: a significant thunderstorm is forecast for Baden-Württemberg. The German Weather Service (DWD) calculates,Tempestas praenuntiet: Periculum tempestatum gravium: Ubi hodie fieri potuit peculiariter gravis. Stuttgart (lsw) - Incommoditas potuit: tonitruum notabile est prospicere Baden-Wurttembergam. The German Weather Service (DWD) reputet,2026-06-05 11:45:06+00:00
ae9266eead160cf8ce1c6800788e5809,2026-06-02T05:07:23Z,'Starkregen',www.zeit.de,de,0.9,"Vorhersage: Blitze und Donner, Starkregen und Hagel in Hessen möglich","Hier finden Sie Informationen zu dem Thema „Vorhersage“. Lesen Sie jetzt „Blitze und Donner, Starkregen und Hagel in Hessen möglich“.",https://www.zeit.de/news/2026-06/02/blitze-und-donner-starkregen-und-hagel-in-hessen-moeglich,https://img.zeit.de/news/2026-06/02/blitze-und-donner-starkregen-und-hagel-in-hessen-moeglich-image-group/wide__1300x731,http://web.archive.org/web/20260603140109/https://www.zeit.de/news/2026-06/02/blitze-und-donner-starkregen-und-hagel-in-hessen-moeglich,"Auf Hessen kommt am Dienstag wechselhaftes Wetter mit örtlicher Unwettergefahr zu. Von Westen können im Laufe des Tages Schauer und teils kräftige Gewitter mit Starkregen, Sturmböen und Hagel heranzi… [+596 chars]",,"Vorhersage: Blitze und Donner, Starkregen und Hagel in Hessen möglich. Hier finden Sie Informationen zu dem Thema „Vorhersage“. Lesen Sie jetzt „Blitze und Donner, Starkregen und Hagel in Hessen möglich“.","Forecast: Lightning and thunder, heavy rain and hail possible in Hesse. Here you will find information on the topic of “prediction”. Now read “Lightning and thunder, heavy rain and hail possible in Hesse”.","Praedictio: Fulgura et tonitrua, pluviae et grandines graves in Hassia fieri. Hic informationes invenies in argumento ""praedictionis"". Iam lege fulgur et tonitrua, pluviae et grandines in Hassia possibilia sunt.",2026-06-05 11:45:06+00:00
d7d1078602a37e51d439f94c64548610,2026-06-02T05:07:23Z,'Starkregen',www.stern.de,de,0.9,"Vorhersage: Blitze und Donner, Starkregen und Hagel in Hessen möglich",Das Wetter kann am Dienstag ungemütlich werden. Kalt wird es nicht - aber im Laufe des Tages können kräftige Gewitter heranziehen. Wie geht es am Mittwoch weiter?,https://www.stern.de/gesellschaft/regional/hessen/vorhersage--blitze-und-donner--starkregen-und-hagel-in-hessen-moeglich-37478540.html,https://image.stern.de/37478542/t/g2/v1/w1440/r1.7778/-/02--kcgczihj6yv4axs2048jpeg---03fa3e0aee429934.jpg,,"Kopiere den aktuellen Link
Zur Merkliste hinzufügen
Das Wetter kann am Dienstag ungemütlich werden. Kalt wird es nicht - aber im Laufe des Tages können kräftige Gewitter heranziehen. Wie geht es am… [+796 chars]",,"Vorhersage: Blitze und Donner, Starkregen und Hagel in Hessen möglich. Das Wetter kann am Dienstag ungemütlich werden. Kalt wird es nicht - aber im Laufe des Tages können kräftige Gewitter heranziehen. Wie geht es am Mittwoch weiter?","Forecast: Lightning and thunder, heavy rain and hail possible in Hesse. The weather can be uncomfortable on Tuesday. It won't be cold - but strong thunderstorms may arrive during the day. What's next on Wednesday?","Praedictio: Fulgura et tonitrua, pluviae et grandines graves in Hassia fieri. Tempestas die Martis incommoda esse potest. Frigidus non erit, sed fortis tonitribus interdiu adveniet. Quid deinde die Mercurii?",2026-06-05 11:45:06+00:00
5d1ad243a468e9bf827afd4d4ccfe440,2026-06-02T05:20:09Z,'Starkregen',www.stern.de,de,0.9,"Vorhersage: Starkregen und Hagel, Blitze und Donner möglich","Das Wetter an Rhein, Mosel und Saar präsentiert sich am Dienstag teils ungemütlich. Kalt wird es nicht - aber im Laufe des Tages können kräftige Gewitter heranziehen. Wie geht es am Mittwoch weiter?",https://www.stern.de/gesellschaft/regional/rheinland-pfalz-saarland/vorhersage--starkregen-und-hagel--blitze-und-donner-moeglich-37478570.html,https://image.stern.de/37478572/t/VF/v1/w1440/r1.7778/-/02--ds3ekplte2v10axs2048jpeg---3dac751f5144febf.jpg,http://web.archive.org/web/20260603032550/https://www.stern.de/gesellschaft/regional/rheinland-pfalz-saarland/vorhersage--starkregen-und-hagel--blitze-und-donner-moeglich-37478570.html,"Kopiere den aktuellen Link
Zur Merkliste hinzufügen
Das Wetter an Rhein, Mosel und Saar präsentiert sich am Dienstag teils ungemütlich. Kalt wird es nicht - aber im Laufe des Tages können kräftige … [+845 chars]",,"Vorhersage: Starkregen und Hagel, Blitze und Donner möglich. Das Wetter an Rhein, Mosel und Saar präsentiert sich am Dienstag teils ungemütlich. Kalt wird es nicht - aber im Laufe des Tages können kräftige Gewitter heranziehen. Wie geht es am Mittwoch weiter?","Forecast: Heavy rain and hail, lightning and thunder possible. The weather on the Rhine, Moselle and Saar was partly uncomfortable on Tuesday. It won't be cold - but strong thunderstorms may arrive during the day. What's next on Wednesday?","Praedictio: Graves pluviae et grandines, fulgura et tonitrua fieri possunt. Tempestas in Rheno, Mosella et Saar die Martis partim incommoditas fuit. Frigidus non erit, sed fortis tonitribus interdiu adveniet. Quid deinde die Mercurii?",2026-06-05 11:45:06+00:00
0bda11be287c4acec1dafe1e7e5cda2d,2026-06-02T05:20:09Z,'Starkregen',www.zeit.de,de,0.9,"Vorhersage: Starkregen und Hagel, Blitze und Donner möglich","Hier finden Sie Informationen zu dem Thema „Vorhersage“. Lesen Sie jetzt „Starkregen und Hagel, Blitze und Donner möglich“.",https://www.zeit.de/news/2026-06/02/starkregen-und-hagel-blitze-und-donner-moeglich,https://img.zeit.de/news/2026-06/02/starkregen-und-hagel-blitze-und-donner-moeglich-image-group/wide__1300x731,http://web.archive.org/web/20260603025510/https://www.zeit.de/news/2026-06/02/starkregen-und-hagel-blitze-und-donner-moeglich,"Das Wetter in Rheinland-Pfalz und im Saarland ist am Dienstag wechselhaft bei lokaler Unwettergefahr. Von Westen können im Laufe des Tages Schauer und teils kräftige Gewitter mit Starkregen, Sturmböe… [+609 chars]",,"Vorhersage: Starkregen und Hagel, Blitze und Donner möglich. Hier finden Sie Informationen zu dem Thema „Vorhersage“. Lesen Sie jetzt „Starkregen und Hagel, Blitze und Donner möglich“.","Forecast: Heavy rain and hail, lightning and thunder possible. Here you will find information on the topic of “prediction”. Now read “Heavy rain and hail, lightning and thunder possible”.","Praedictio: Graves pluviae et grandines, fulgura et tonitrua fieri possunt. Hic informationes invenies in argumento ""praedictionis"". Nunc lege ""pluvia et grandines, fulgura et tonitrua possibilia"".",2026-06-05 11:45:06+00:00
64df925f6ae578be4fac436fe053fde9,2026-06-04T05:42:29Z,'Starkregen',www.stern.de,de,0.9,Wetter im Norden: Unwetter mit Sturmböen und Hagel erwartet,"Eine Gewitterfront zieht über Norddeutschland: Am Donnerstag wird in Mecklenburg-Vorpommern wegen Hagel, Sturm und Starkregen gewarnt. Auch am Wochenende wird es nass und gewittrig.",https://www.stern.de/gesellschaft/regional/hamburg-schleswig-holstein/wetter-im-norden--unwetter-mit-sturmboeen-und-hagel-erwartet-37490502.html,https://image.stern.de/37490504/t/pr/v1/w1440/r1.7778/-/04--lqxiondmxev5axs2048jpeg---3eb029054af671cb.jpg,,"Kopiere den aktuellen Link
Zur Merkliste hinzufügen
Eine Gewitterfront zieht über Norddeutschland: Am Donnerstag wird in Mecklenburg-Vorpommern wegen Hagel, Sturm und Starkregen gewarnt. Auch am Wo… [+1203 chars]",,"Wetter im Norden: Unwetter mit Sturmböen und Hagel erwartet. Eine Gewitterfront zieht über Norddeutschland: Am Donnerstag wird in Mecklenburg-Vorpommern wegen Hagel, Sturm und Starkregen gewarnt. Auch am Wochenende wird es nass und gewittrig.","Weather in the north: Storms with squalls and hail expected. A thunderstorm front is moving across northern Germany: There will be a warning about hail, storms and heavy rain in Mecklenburg-Western Pomerania on Thursday. It will also be wet and thundery this weekend.","Tempestas in aquilone: ​​Tempestates cum procellis et grandine exspectantur. Frons tonitrui trans Germaniam septentrionalem movetur: monitum erit de grandine, procellis et pluviis in Pomerania Mecklenburgo-Occidentis die Iovis. Etiam volutpat id tingere et tonitru.",2026-06-05 11:45:06+00:00
c02a03c27c18bb06dbecf7301001e955,2026-06-04T06:11:00Z,'Starkregen',www.stern.de,de,0.9,"Unwettergefahr: DWD warnt vor Starkregen, Hagel und Tornados – Karten zeigen die Lage",Eine breite Unwetterfront zieht am Donnerstag über Deutschland. Der Wetterdienst warnt dabei vor allem für eine Region vor extremen Bedingungen – bis zu Tornados.,https://www.stern.de/panorama/wetter/dwd-warnt-vor-schweren-unwettern-mit-starkregen-und-tornados-37490496.html,https://image.stern.de/35923446/t/Dr/v2/w1440/r1.7778/-/teaser-ani-unwetterwarnung.gif,,"Kopiere den aktuellen Link
Zur Merkliste hinzufügen
Eine breite Unwetterfront zieht am Donnerstag über Deutschland. Der Wetterdienst warnt dabei vor allem für eine Region vor extremen Bedingungen b… [+3938 chars]",,"Unwettergefahr: DWD warnt vor Starkregen, Hagel und Tornados – Karten zeigen die Lage. Eine breite Unwetterfront zieht am Donnerstag über Deutschland. Der Wetterdienst warnt dabei vor allem für eine Region vor extremen Bedingungen – bis zu Tornados.","Danger of severe weather: DWD warns of heavy rain, hail and tornadoes – maps show the situation. A broad storm front is moving across Germany on Thursday. The weather service warns of extreme conditions in one region in particular - up to tornadoes.","Periculum tempestatum gravium: DWD monet pluviae, grandinis et turbines - tabulae condicionem ostendunt. Frons lata tempestas die Iovis trans Germaniam movetur. Ministerium tempestatum admonet condiciones extremas in una regione praesertim - usque ad tornados.",2026-06-05 11:45:06+00:00
dd481ec10ba49f9b4dd928c2ef484553,2026-06-02T05:13:08Z,'Starkregen',www.zeit.de,de,0.9,Stürmisches Wetter: Starkregen bis 40 Liter - Wetterdienst warnt vor Unwetter,Hier finden Sie Informationen zu dem Thema „Stürmisches Wetter“. Lesen Sie jetzt „Starkregen bis 40 Liter - Wetterdienst warnt vor Unwetter“.,https://www.zeit.de/news/2026-06/02/starkregen-bis-40-liter-wetterdienst-warnt-vor-unwetter,https://img.zeit.de/news/2026-06/02/starkregen-bis-40-liter-wetterdienst-warnt-vor-unwetter-image-group/wide__1300x731,,"Der Deutsche Wetterdienst warnt vor Gewitter mit Starkregen und Unwetter, die heute ab dem Mittag von Westen her durch Nordrhein-Westfalen ziehen. Dabei seien lokal heftige Starkregenfälle mit bis zu… [+475 chars]",,Stürmisches Wetter: Starkregen bis 40 Liter - Wetterdienst warnt vor Unwetter. Hier finden Sie Informationen zu dem Thema „Stürmisches Wetter“. Lesen Sie jetzt „Starkregen bis 40 Liter - Wetterdienst warnt vor Unwetter“.,Stormy weather: heavy rain up to 40 liters - weather service warns of severe weather. Here you will find information on the topic of “Stormy Weather”. Now read “Heavy rain up to 40 liters - weather service warns of severe weather”.,"Tempestas turbulenta: pluviae graves usque ad 40 liters - tempestas servitium monet tempestatis gravibus. Hic informationes invenies in argumento ""Tempestatis procellae"". Nunc lege ""Imber gravis usque ad 40 liters - tempestas servitium monet tempestatis gravibus"".",2026-06-06 15:53:48+00:00
c7befa05c417713e95f9636a78bf24dc,2026-06-03T06:27:34Z,'Starkregen',www.zeit.de,de,0.9,"Wetter: Im Norden drohen Gewitter, Starkregen und Hagel","Hier finden Sie Informationen zu dem Thema „Wetter“. Lesen Sie jetzt „Im Norden drohen Gewitter, Starkregen und Hagel“.",https://www.zeit.de/news/2026-06/03/im-norden-drohen-gewitter-starkregen-und-hagel,https://img.zeit.de/news/2026-06/03/im-norden-drohen-gewitter-starkregen-und-hagel-image-group/wide__1300x731,http://web.archive.org/web/20260604043340/https://www.zeit.de/news/2026-06/03/im-norden-drohen-gewitter-starkregen-und-hagel,"Gewitter, Starkregen und Hagel - die Menschen im Norden müssen sich in den kommenden Tagen eher auf schlechtes Wetter einstellen. Laut dem Deutschen Wetterdienst (DWD) soll es zunächst wechselhaft bi… [+1110 chars]",,"Wetter: Im Norden drohen Gewitter, Starkregen und Hagel. Hier finden Sie Informationen zu dem Thema „Wetter“. Lesen Sie jetzt „Im Norden drohen Gewitter, Starkregen und Hagel“.","Weather: There is a risk of thunderstorms, heavy rain and hail in the north. Here you will find information on the topic of “weather”. Now read “There is a threat of thunderstorms, heavy rain and hail in the north”.","Tempestas: Periculum est tonitrui, pluviae et grandinis in aquilone. Hic informationes invenies in argumento ""tempestatis"". Nunc lege ""Minatio est tonitruum et pluviae gravis et grando in septentrione"".",2026-06-06 15:53:48+00:00
95925c9243cd7818e088697f81544c74,2026-06-04T05:35:53Z,'Starkregen',www.zeit.de,de,0.9,"Wettervorhersage: Hagel, Sturmböen, Starkregen – Das bringt das Wetter heute","Hier finden Sie Informationen zu dem Thema „Wettervorhersage“. Lesen Sie jetzt „Hagel, Sturmböen, Starkregen – Das bringt das Wetter heute“.",https://www.zeit.de/news/2026-06/04/hagel-sturmboeen-starkregen-das-bringt-das-wetter-heute,https://img.zeit.de/news/2026-06/04/hagel-sturmboeen-starkregen-das-bringt-das-wetter-heute-image-group/wide__1300x731,,"In Teilen Deutschlands wird es ungemütlich: Im Südwesten sind kräftige Gewitter mit Sturmböen, Hagel und Starkregen möglich. Dort seien auch Orkanböen mit zu 129 Kilometern pro Stunde und kurzlebige … [+1115 chars]",,"Wettervorhersage: Hagel, Sturmböen, Starkregen – Das bringt das Wetter heute. Hier finden Sie Informationen zu dem Thema „Wettervorhersage“. Lesen Sie jetzt „Hagel, Sturmböen, Starkregen – Das bringt das Wetter heute“.","Weather forecast: Hail, squalls, heavy rain – this is what the weather will bring today. Here you will find information on the subject of “weather forecast”. Now read “Hail, squalls, heavy rain – that’s what the weather will bring today”.","Tempestas praenuntiet: Salve, procellis, imbres graves — haec tempestas hodie adferent. Hic invenies informationes de re ""tempestatis praenuntientur"". Nunc lege ""Ave, procellae, imbres graves - id est quod hodie tempestas afferet"".",2026-06-06 15:53:48+00:00
