index,published,keyword,domain,language,valid,title,description,url,image,archive,content,quote,de,en,la,added
b373a759f3f8e1f0bc4e5ae5024b4ec7,2026-03-03T12:14:00Z,'Regenmengen',www.freitag.de,de,0.9,"Regenwald vor dem Kipppunkt: Wenn die Bäume abgeholzt werden, bleibt der Regen aus","Grünes Wissen to go: Tropische Wälder produzieren gigantische Regenmengen. Pro Hektar entstehen mindestens 2,4 Millionen Liter pro Jahr. Allerdings gefährdet der Klimawandel diese Produktivität Der Fotosynthese sei Dank: Regenwälder produzieren große Mengen N…",https://www.freitag.de/autoren/nick-reimer/regenwald-vor-dem-kipppunkt-wenn-baeume-abgeholzt-werden-bleibt-der-regen-aus,https://www.freitag.de/autoren/nick-reimer/regenwald-vor-dem-kipppunkt-wenn-baeume-abgeholzt-werden-bleibt-der-regen-aus/@@images/image/great,http://web.archive.org/web/20260303123801/https://www.freitag.de/autoren/nick-reimer/regenwald-vor-dem-kipppunkt-wenn-baeume-abgeholzt-werden-bleibt-der-regen-aus,"Der Fotosynthese sei Dank: Regenwälder produzieren große Mengen Niederschlag. Ein britisch-brasilianisches Forscherteam hat nun ermittelt, dass pro Hektar im Durchschnitt 240 Liter Regen pro Jahr dur… [+3886 chars]",,"Regenwald vor dem Kipppunkt: Wenn die Bäume abgeholzt werden, bleibt der Regen aus. Grünes Wissen to go: Tropische Wälder produzieren gigantische Regenmengen. Pro Hektar entstehen mindestens 2,4 Millionen Liter pro Jahr. Allerdings gefährdet der Klimawandel diese Produktivität Der Fotosynthese sei Dank: Regenwälder produzieren große Mengen N…","Rainforest nearing the tipping point: If the trees are cut down, there will be no rain. Green knowledge to go: Tropical forests produce gigantic amounts of rain. At least 2.4 million liters are produced per hectare per year. However, climate change is endangering this productivity. Thanks to photosynthesis: rainforests produce large amounts of N...","Rainforest prope tipping punctum: Si caesa sunt arbores, pluvia non erit. Viridis cognitio ad eundum: Tropical silvae ingentes pluvias efficiunt. Saltem 2.4 decies centena liter per hectare per annum producuntur. Sed mutatio climatis haec fructibus in discrimen vocatur. Gratias agentes photosynthesi: pluviae silvae magnas moles N... faciunt.",2026-03-05 21:04:20+00:00
e00a44a3a4542eb4582c807aa2f4a8ef,2026-03-03T15:36:34Z,'Starkregen',www.stern.de,de,0.9,Wetter: Digitaler Zwilling zeigt Auswirkungen von Starkregen,"Überflutete Keller, eine überlastete Kanalisation und Überschwemmungen: Starkregen kann enorme Schäden verursachen und Menschenleben gefährden. Lässt sich die Gefahr vorher abschätzen?",https://www.stern.de/gesellschaft/regional/sachsen/wetter--digitaler-zwilling-zeigt-auswirkungen-von-starkregen-37188104.html,https://image.stern.de/37188106/t/Rn/v1/w1440/r1.7778/-/03--bzmpn7tv6vv9axs2048jpeg---b0a9af72e5297017.jpg,,"Kopiere den aktuellen Link
Zur Merkliste hinzufügen
Überflutete Keller, eine überlastete Kanalisation und Überschwemmungen: Starkregen kann enorme Schäden verursachen und Menschenleben gefährden. L… [+995 chars]",,"Wetter: Digitaler Zwilling zeigt Auswirkungen von Starkregen. Überflutete Keller, eine überlastete Kanalisation und Überschwemmungen: Starkregen kann enorme Schäden verursachen und Menschenleben gefährden. Lässt sich die Gefahr vorher abschätzen?","Weather: Digital twin shows effects of heavy rain. Flooded basements, an overloaded sewer system and flooding: heavy rain can cause enormous damage and endanger human lives. Can the danger be assessed in advance?","Tempestas: Digital gemina ostendit effectus pluviae gravis. Fundamenta inundata, cloacas cumulatas et inundationes: pluviae graves damnum ingens inferre et vitas hominum periclitari possunt. Potestne periculum aestimari?",2026-03-06 20:58:02+00:00
8434630ac22da3a5b3eced965cce99a3,2026-03-07T15:49:36Z,'Regenmassen',www.stern.de,de,0.9,Unwetter: Mindestens 23 Tote bei Überschwemmungen in Nairobi,Regenmassen reißen in Kenias Hauptstadt Menschen und Autos mit. Die Metropole steht unter Wasser. Der Wetterdienst warnt vor weiteren starken Niederschlägen.,https://www.stern.de/panorama/unwetter--mindestens-23-tote-bei-ueberschwemmungen-in-nairobi-37200384.html,https://image.stern.de/37200386/t/RO/v1/w1440/r1.7778/-/07--nevacmx76kv5axs2048jpeg---7136953e54923620.jpg,,"Kopiere den aktuellen Link
Zur Merkliste hinzufügen
Regenmassen reißen in Kenias Hauptstadt Menschen und Autos mit. Die Metropole steht unter Wasser. Der Wetterdienst warnt vor weiteren starken Nie… [+1167 chars]",,Unwetter: Mindestens 23 Tote bei Überschwemmungen in Nairobi. Regenmassen reißen in Kenias Hauptstadt Menschen und Autos mit. Die Metropole steht unter Wasser. Der Wetterdienst warnt vor weiteren starken Niederschlägen.,Storm: At least 23 dead in floods in Nairobi. Massive rain sweeps away people and cars in Kenya's capital. The metropolis is under water. The weather service warns of further heavy rainfall.,Storm: Saltem 23 in inundationibus Nairobi mortui sunt. Imber ingens homines rapit et cars in Kenia capitali. Metropolis sub aqua est. Tempestas servitium monet de pluviis gravioribus.,2026-03-12 05:05:40+00:00
14820cb17ea9b7905ec6d6d0085e0c9a,2026-03-07T15:50:39Z,'Regenmassen',www.tagesspiegel.de,de,0.9,Unwetter: Mindestens 23 Tote bei Überschwemmungen in Nairobi,Regenmassen reißen in Kenias Hauptstadt Menschen und Autos mit. Die Metropole steht unter Wasser. Der Wetterdienst warnt vor weiteren starken Niederschlägen.,https://www.tagesspiegel.de/gesellschaft/panorama/unwetter-mindestens-23-tote-bei-uberschwemmungen-in-nairobi-15328945.html,https://www.tagesspiegel.de/images/15328944/alternates/BASE_16_9_W1400/1772898639000/unwetter-in-kenia.jpeg,,"In Kenias Hauptstadt Nairobi sind der Polizei zufolge aufgrund schwerer Regenfälle und Überschwemmungen mindestens 23 Menschen ums Leben gekommen. Einige Einwohner seien demnach ertrunken, andere auf… [+1050 chars]",,Unwetter: Mindestens 23 Tote bei Überschwemmungen in Nairobi. Regenmassen reißen in Kenias Hauptstadt Menschen und Autos mit. Die Metropole steht unter Wasser. Der Wetterdienst warnt vor weiteren starken Niederschlägen.,Storm: At least 23 dead in floods in Nairobi. Massive rain sweeps away people and cars in Kenya's capital. The metropolis is under water. The weather service warns of further heavy rainfall.,Storm: Saltem 23 in inundationibus Nairobi mortui sunt. Imber ingens homines rapit et cars in Kenia capitali. Metropolis sub aqua est. Tempestas servitium monet de pluviis gravioribus.,2026-03-12 05:05:40+00:00
ce7017425b98b700da7e18a276fdd87b,2026-03-05T09:45:24Z,'Starkregen',www.stern.de,de,0.9,Klimaanpassungskonferenz: Minister Goldschmidt: Klimawandel längst spürbar,"Wie Schleswig-Holstein mit Starkregen, Trockenperioden und Hitzewellen umgehen sollte: Experten und Kommunen suchen Lösungen für mehr Widerstandskraft gegen den Klimawandel.",https://www.stern.de/gesellschaft/regional/hamburg-schleswig-holstein/klimaanpassungskonferenz--minister-goldschmidt--klimawandel-laengst-spuerbar-37193556.html,https://image.stern.de/37193558/t/2Z/v1/w1440/r1.7778/-/05--kjfjgrzl2bv7axs2048jpeg---ad1ff26362520ccf.jpg,http://web.archive.org/web/20260307034754/https://www.stern.de/gesellschaft/regional/hamburg-schleswig-holstein/klimaanpassungskonferenz--minister-goldschmidt--klimawandel-laengst-spuerbar-37193556.html,"Kopiere den aktuellen Link
Zur Merkliste hinzufügen
Wie Schleswig-Holstein mit Starkregen, Trockenperioden und Hitzewellen umgehen sollte: Experten und Kommunen suchen Lösungen für mehr Widerstands… [+911 chars]",,"Klimaanpassungskonferenz: Minister Goldschmidt: Klimawandel längst spürbar. Wie Schleswig-Holstein mit Starkregen, Trockenperioden und Hitzewellen umgehen sollte: Experten und Kommunen suchen Lösungen für mehr Widerstandskraft gegen den Klimawandel.","Climate Adaptation Conference: Minister Goldschmidt: Climate change has long been noticeable. How Schleswig-Holstein should deal with heavy rain, dry periods and heat waves: Experts and municipalities are looking for solutions for greater resilience to climate change.","Clima Accommodatio Conferentiae: Minister Goldschmidt: Clima mutatio iam diu notabilis fuit. Quomodo Schleswig-Holstein de gravibus pluviis, siccis periodis et undis aestuantibus agere debet: Periti et municipia solutiones maiorem difficultatem ad mutationem climatis quaerunt.",2026-03-13 15:23:58+00:00
3e7a65e8f9f8f5bd14efdd91f218470b,2026-03-12T08:53:50Z,'Unwetter Regen',www.stern.de,de,0.9,Unwetter: Starkregen bedroht Kaffee aus Brasilien und macht ihn teurer,Extremer Regen löst im wichtigsten Kaffee-Anbauland Brasilien Erdrutsche mit verheerenden Folgen aus. Das wird auch hier an der Kaffeemaschine spürbar.,https://www.stern.de/panorama/wissen/unwetter--starkregen-bedroht-kaffee-aus-brasilien-und-macht-ihn-teurer-37214456.html,https://image.stern.de/37214458/t/98/v1/w1440/r1.7778/-/12--5lxlvvfwv5v3axs2048jpeg---f1acf59d81f34dc3.jpg,,"Kopiere den aktuellen Link
Zur Merkliste hinzufügen
Extremer Regen löst im wichtigsten Kaffee-Anbauland Brasilien Erdrutsche mit verheerenden Folgen aus. Das wird auch hier an der Kaffeemaschine sp… [+2599 chars]",,Unwetter: Starkregen bedroht Kaffee aus Brasilien und macht ihn teurer. Extremer Regen löst im wichtigsten Kaffee-Anbauland Brasilien Erdrutsche mit verheerenden Folgen aus. Das wird auch hier an der Kaffeemaschine spürbar.,"Storm: Heavy rain threatens coffee from Brazil and makes it more expensive. Extreme rain triggers landslides with devastating consequences in Brazil, the most important coffee-growing country. This is also noticeable here in the coffee machine.","Tempestas: Imber gravis capulus e Brasilia minatur et eam cariorem reddit. Maxime pluviae triggers proruit cum consectariis vastandis in Brasilia, maximae reipublicae coffee-crescentis. Hoc etiam notabile est hic in machina capulus.",2026-03-13 15:23:58+00:00
be80abcb38125b4d31af4bf925a849b9,2026-03-12T08:55:07Z,'Starkregen',www.tagesspiegel.de,de,0.9,Unwetter: Starkregen bedroht Kaffee aus Brasilien und macht ihn teurer,Extremer Regen löst im wichtigsten Kaffee-Anbauland Brasilien Erdrutsche mit verheerenden Folgen aus. Das wird auch hier an der Kaffeemaschine spürbar.,https://www.tagesspiegel.de/wissen/unwetter-starkregen-bedroht-kaffee-aus-brasilien-und-macht-ihn-teurer-15346097.html,https://www.tagesspiegel.de/images/15346096/alternates/BASE_16_9_W1400/1773305707000/kaffeeanbau-in-brasilien.jpeg,,Heftiger Starkregen bedroht laut einer Studie zunehmend die Kaffeeproduktion im weltweit größten Anbauland Brasilien. Die starken Niederschläge könnten auf Arabica-Plantagen im Bundesstaat Minas Gera… [+2488 chars],,Unwetter: Starkregen bedroht Kaffee aus Brasilien und macht ihn teurer. Extremer Regen löst im wichtigsten Kaffee-Anbauland Brasilien Erdrutsche mit verheerenden Folgen aus. Das wird auch hier an der Kaffeemaschine spürbar.,"Storm: Heavy rain threatens coffee from Brazil and makes it more expensive. Extreme rain triggers landslides with devastating consequences in Brazil, the most important coffee-growing country. This is also noticeable here in the coffee machine.","Tempestas: Imber gravis capulus e Brasilia minatur et eam cariorem reddit. Maxime pluviae triggers proruit cum consectariis vastandis in Brasilia, maximae reipublicae coffee-crescentis. Hoc etiam notabile est hic in machina capulus.",2026-03-13 15:23:58+00:00
6f9b706746a85e7cc7d31307eed248e2,2026-03-12T09:44:10Z,'Starkregen',www.bild.de,de,0.9,Unwetterdrama in Brasilien - Starkregen macht unseren Kaffee teurer,Über dem weltweit wichtigsten Kaffee-Anbauland ergießt sich extremer Starkregen. Mit Folgen für die Kaffeepreise,https://www.bild.de/leben-wissen/mein-recht-verbraucherportal/brasilien-starkregen-macht-unseren-kaffee-teurer-69b283564f82f3bb5d803e10,"https://images.bild.de/69b283564f82f3bb5d803e10/29e2e2b9ed9e35a3a190a4c13710be66,35339968?w=1280",,TTS-Player überspringenArtikel weiterlesenJuiz de Fora (Brasilien) Über dem weltweit wichtigsten Kaffee-Anbauland ergießt sich extremer Starkregen. Die gewaltigen Wassermassen lösen in Brasilien Erdr… [+2054 chars],,Unwetterdrama in Brasilien - Starkregen macht unseren Kaffee teurer. Über dem weltweit wichtigsten Kaffee-Anbauland ergießt sich extremer Starkregen. Mit Folgen für die Kaffeepreise,Storm drama in Brazil - heavy rain makes our coffee more expensive. Extremely heavy rain is pouring over the world's most important coffee-growing country. With consequences for coffee prices,Drama procella in Brasilia - pluvia gravis capulus nostrum carius facit. Imber maxime gravis perfundit in regionem mundi maximi momenti capulus crescens. Cum consequuntur pro capulus prices,2026-03-13 15:23:58+00:00
1984db932fb167e6732ec72d467e7957,2026-03-12T10:13:31Z,'Starkregen',www.diepresse.com,de,0.9,Starkregen bedroht Kaffee aus Brasilien und macht ihn teurer,Bereits in den vergangenen Jahren hat extremes Wetter zu einem Rückgang der Kaffeeproduktion um 15 bis 20 Prozent geführt und die Weltmarktpreise steigen lassen.,https://www.diepresse.com/20669388/starkregen-bedroht-kaffee-aus-brasilien-und-macht-ihn-teurer,https://img.diepresse.com/public/incoming/l6xru8-2026-03-06t122953z68689528rc2dyjauibt9rtrmadp3brazil-coffeejpg/alternates/DPR_SOCIAL_NACHRICHTEN/2026-03-06T122953Z_68689528_RC2DYJAUIBT9_RTRMADP_3_BRAZIL-COFFEE.JPG,,"Bereits in den vergangenen Jahren hat extremes Wetter zu einem Rückgang der Kaffeeproduktion um 15 bis 20 Prozent geführt und die Weltmarktpreise steigen lassen. 
Heftiger Starkregen bedroht laut ei… [+2300 chars]",,Starkregen bedroht Kaffee aus Brasilien und macht ihn teurer. Bereits in den vergangenen Jahren hat extremes Wetter zu einem Rückgang der Kaffeeproduktion um 15 bis 20 Prozent geführt und die Weltmarktpreise steigen lassen.,"Heavy rain threatens coffee from Brazil and makes it more expensive. In recent years, extreme weather has led to a 15 to 20 percent decline in coffee production and caused world market prices to rise.",Imber gravis capulus e Brasilia minatur et eam cariorem reddit. Superioribus annis extrema tempestas ad 15 ad 20 centesimas declinationem in productione capulus duxit et pretium mercatum mundum surgere effecit.,2026-03-13 15:23:58+00:00
928bed4fffa07f58e057cbed44015919,2026-03-12T12:02:00Z,'Starkregen',www.spektrum.de,de,0.9,Unwetter: Starkregen bedroht Kaffee aus Brasilien und macht ihn teurer,Extremer Regen löst im wichtigsten Kaffee-Anbauland Brasilien Erdrutsche mit verheerenden Folgen aus. Das wird auch hier an der Kaffeemaschine spürbar.,https://www.spektrum.de/news/starkregen-bedroht-kaffee-aus-brasilien-und-macht-ihn-teurer/2314565,https://static.spektrum.de/fm/912/f1920x1080/AdobeStock_125914158.jpeg,,"Dieser Inhalt wurde automatisch von der Deutschen Presse-Agentur (dpa) übernommen und von Spektrum.de nicht redaktionell bearbeitet.
Heftiger Starkregen bedroht laut einer Studie zunehmend die Kaffe… [+798 chars]",,Unwetter: Starkregen bedroht Kaffee aus Brasilien und macht ihn teurer. Extremer Regen löst im wichtigsten Kaffee-Anbauland Brasilien Erdrutsche mit verheerenden Folgen aus. Das wird auch hier an der Kaffeemaschine spürbar.,"Storm: Heavy rain threatens coffee from Brazil and makes it more expensive. Extreme rain triggers landslides with devastating consequences in Brazil, the most important coffee-growing country. This is also noticeable here in the coffee machine.","Tempestas: Imber gravis capulus e Brasilia minatur et eam cariorem reddit. Maxime pluviae triggers proruit cum consectariis vastandis in Brasilia, maximae reipublicae coffee-crescentis. Hoc etiam notabile est hic in machina capulus.",2026-03-13 15:23:58+00:00
72600d46f58d10c29a28a5fdc6779a3a,2026-03-10T04:50:01Z,'Starkregen',www.zeit.de,de,0.9,Wetter: Wo Gewitter und Starkregen die Frühlingsfreude stören können,Hier finden Sie Informationen zu dem Thema „Wetter“. Lesen Sie jetzt „Wo Gewitter und Starkregen die Frühlingsfreude stören können“.,https://www.zeit.de/news/2026-03/10/wo-gewitter-und-starkregen-die-fruehlingsfreude-stoeren-koennen,https://img.zeit.de/news/2026-03/10/wo-gewitter-und-starkregen-die-fruehlingsfreude-stoeren-koennen-image-group/wide__1300x731,http://web.archive.org/web/20260311070540/https://www.zeit.de/news/2026-03/10/wo-gewitter-und-starkregen-die-fruehlingsfreude-stoeren-koennen,"Wer heute im Südwesten unterwegs ist, sollte den Himmel im Blick behalten: Der Vorhersage des Deutschen Wetterdienstes (DWD) zufolge besteht am Nachmittag im Schwarzwald und auf der Alb ein geringes … [+1594 chars]",,Wetter: Wo Gewitter und Starkregen die Frühlingsfreude stören können. Hier finden Sie Informationen zu dem Thema „Wetter“. Lesen Sie jetzt „Wo Gewitter und Starkregen die Frühlingsfreude stören können“.,Weather: Where thunderstorms and heavy rain can disrupt the joy of spring. Here you will find information on the topic of “weather”. Now read “Where thunderstorms and heavy rain can disrupt the joy of spring”.,"Tempestas: Ubi tonitribus et pluviis laetitiam veris perturbare potest. Hic informationes invenies in argumento ""tempestatis"". Nunc lege ""Ubi tonitrua et pluviae graves laetitiam veris perturbare possunt"".",2026-03-18 15:49:51+00:00
9fd7df81b890ee3bba85263929fb898d,2026-03-10T04:50:01Z,'Starkregen',www.stern.de,de,0.9,Wetter: Wo Gewitter und Starkregen die Frühlingsfreude stören können,"Nach milden Temperaturen drohen zur Wochenmitte mehr Wolken, Schauer und teils sogar Frost im Südwesten. Wo es besonders unbeständig wird, verrät die aktuelle Prognose.",https://www.stern.de/gesellschaft/regional/baden-wuerttemberg/wetter--wo-gewitter-und-starkregen-die-fruehlingsfreude-stoeren-koennen-37206666.html,https://image.stern.de/37206668/t/f9/v1/w1440/r1.7778/-/10--2wvtb66ek6v3axs2048jpeg---12f1dc437137fd37.jpg,,"Kopiere den aktuellen Link
Zur Merkliste hinzufügen
Nach milden Temperaturen drohen zur Wochenmitte mehr Wolken, Schauer und teils sogar Frost im Südwesten. Wo es besonders unbeständig wird, verrät… [+1778 chars]",,"Wetter: Wo Gewitter und Starkregen die Frühlingsfreude stören können. Nach milden Temperaturen drohen zur Wochenmitte mehr Wolken, Schauer und teils sogar Frost im Südwesten. Wo es besonders unbeständig wird, verrät die aktuelle Prognose.","Weather: Where thunderstorms and heavy rain can disrupt the joy of spring. After mild temperatures, there is a risk of more clouds, showers and sometimes even frost in the southwest in the middle of the week. The current forecast reveals where things will be particularly unstable.","Tempestas: Ubi tonitribus et pluviis laetitiam veris perturbare potest. Post temperaturas lenis periculum est plurium nubium, imbrium, interdum etiam frigoris in medio hebdomadis inter meridiem. Praedictio praesens indicat ubi res maxime instabiles erunt.",2026-03-18 15:49:51+00:00
f2343db264a2fc81473a6cd8535fb7da,2026-03-12T08:53:50Z,'Starkregen',www.zeit.de,de,0.9,Unwetter: Starkregen bedroht Kaffee aus Brasilien und macht ihn teurer,Hier finden Sie Informationen zu dem Thema „Unwetter“. Lesen Sie jetzt „Starkregen bedroht Kaffee aus Brasilien und macht ihn teurer“.,https://www.zeit.de/news/2026-03/12/starkregen-bedroht-kaffee-aus-brasilien-und-macht-ihn-teurer,https://img.zeit.de/news/2026-03/12/starkregen-bedroht-kaffee-aus-brasilien-und-macht-ihn-teurer-image-group/wide__1300x731,,Heftiger Starkregen bedroht laut einer Studie zunehmend die Kaffeeproduktion im weltweit größten Anbauland Brasilien. Die starken Niederschläge könnten auf Arabica-Plantagen im Bundesstaat Minas Gera… [+2432 chars],,Unwetter: Starkregen bedroht Kaffee aus Brasilien und macht ihn teurer. Hier finden Sie Informationen zu dem Thema „Unwetter“. Lesen Sie jetzt „Starkregen bedroht Kaffee aus Brasilien und macht ihn teurer“.,Storm: Heavy rain threatens coffee from Brazil and makes it more expensive. Here you will find information on the topic of “storms”. Now read “Heavy rain threatens coffee from Brazil and makes it more expensive”.,"Tempestas: Imber gravis capulus e Brasilia minatur et eam cariorem reddit. Hic informationes invenies in argumento ""procellae"". Nunc legitur ""Imber gravis capulus e Brasilia minatur et eam cariorem facit"".",2026-03-18 15:49:51+00:00
3601d9c15cbb3dfed40384a0b4cd2bf0,2026-03-18T10:36:17Z,'Starkregen',www.tagesspiegel.de,de,0.9,Wasserknappheit in Deutschland : Warum Trinkwasser fehlt – obwohl genug Wasser da ist,"Trockenperioden und Starkregen wechseln sich in Deutschland ab. Es fehlt nicht unbedingt an Wasser, sondern an Verteilung, Qualität und Timing. Genau das könnte jedoch schneller zum Problem werden, als viele denken.",https://www.tagesspiegel.de/wissen/wasserknappheit-in-deutschland-warum-trinkwasser-fehlt--obwohl-genug-wasser-da-ist-15370317.html,https://www.tagesspiegel.de/images/15370389/alternates/BASE_16_9_W1400/1773828635000/niedriger-pegelstand-an-der-elbe.jpeg,,"Ein Teil des Bodensees ausgetrocknet, der Schiffsverkehr im Rhein lahmgelegt: In den vergangenen Jahren haben Trockenperioden die Pegelstände zeitweise stark sinken lassen. Wasserknappheit ist längst… [+5363 chars]",,"Wasserknappheit in Deutschland : Warum Trinkwasser fehlt – obwohl genug Wasser da ist. Trockenperioden und Starkregen wechseln sich in Deutschland ab. Es fehlt nicht unbedingt an Wasser, sondern an Verteilung, Qualität und Timing. Genau das könnte jedoch schneller zum Problem werden, als viele denken.","Water shortage in Germany: Why there is a lack of drinking water – even though there is enough water. Dry periods and heavy rain alternate in Germany. It's not necessarily a lack of water, but a lack of distribution, quality and timing. However, this could become a problem sooner than many people think.","Aquae penuriae in Germania: Cur aquae penuria est - licet aqua satis est. Arida tempora et pluviae alternae in Germania. Non est necessario defectus aquarum, sed defectus distributionis, qualitas et leo. Sed hoc problema citius fieri posse quam multi putant.",2026-03-20 05:05:37+00:00
6b942769123ad2fd3fedfd180a8f1bbe,2026-03-19T11:32:57Z,'Unwetterwarnung',www.bild.de,de,0.9,Unwetterwarnung für die Kanaren - „Regenmengen wie zur Ahrtal-Flut“,"Sturm, Flut und heftige Regenfälle. Für die Kanarischen Inseln gibt es an diesem Wochenende dringende Unwetterwarnungen. Informieren Sie sich vor Ort, um...",https://www.bild.de/news/unwetterwarnung-fuer-die-kanaren-regenmengen-wie-zur-ahrtal-flut-69bbc743d225a75f4a2348cf,"https://images.bild.de/69bbc743d225a75f4a2348cf/9f0a8cf1ab55d851136e92bc2cd8cf12-landscape,aacf18bf?w=1280",,"Mehr zum Video anzeigen 
Sturm, Flut und heftige Regenfälle. Für die Kanarischen Inseln gibt es an diesem Wochenende dringende Unwetterwarnungen. Informieren Sie sich vor Ort, um mögliche Risiken zu… [+64 chars]",,"Unwetterwarnung für die Kanaren - „Regenmengen wie zur Ahrtal-Flut“. Sturm, Flut und heftige Regenfälle. Für die Kanarischen Inseln gibt es an diesem Wochenende dringende Unwetterwarnungen. Informieren Sie sich vor Ort, um...","Storm warning for the Canary Islands - “Amounts of rain like the Ahrtal flood”. Storms, floods and heavy rains. There are urgent severe weather warnings for the Canary Islands this weekend. Find out more on site to...","Tempestas admonitionis in insulis Canariis - ""Modes pluviae sicut diluvium Ahrtal"". Tempestates, flumina et imbres. Gravissimae tempestates urgentes admonitiones pro insulis Canariis hoc weekend. Plura reperire in situ ad...",2026-03-20 15:23:30+00:00
44b220fd1db703665af2a5926120dc52,2026-03-17T05:30:43Z,'Regenmengen',www.diepresse.com,de,0.9,Wasserfälle am Uluru: Rekordregen in Australiens Zentrum,Die Behörden warnen Touristen vor den Auswirkungen der enormen Regenmengen im Zentrum Australiens rund um den berühmten Felsen Uluru.,https://www.diepresse.com/20683104/wasserfaelle-am-uluru-rekordregen-in-australiens-zentrum,https://img.diepresse.com/public/incoming/cvnvf2-australia-denmarkroyals/alternates/DPR_SOCIAL_NACHRICHTEN/AUSTRALIA-DENMARKROYALS,,"Die Behörden warnen Touristen vor den Auswirkungen der enormen Regenmengen im Zentrum Australiens rund um den berühmten Felsen Uluru.
Nach Rekordregenfällen im Zentrum von Australien und speziell ru… [+1207 chars]",,Wasserfälle am Uluru: Rekordregen in Australiens Zentrum. Die Behörden warnen Touristen vor den Auswirkungen der enormen Regenmengen im Zentrum Australiens rund um den berühmten Felsen Uluru.,Waterfalls at Uluru: Record rainfall in central Australia. Authorities are warning tourists about the impact of enormous amounts of rain in central Australia around the famous rock Uluru.,Cataractae ad Uluru: Record pluviae in Australia centrali. Auctoritates monent peregrinatores de impulsu ingentes pluviarum in Australia centrali circa petram nobilem Uluru.,2026-03-21 14:55:45+00:00
