index,published,keyword,domain,language,valid,title,description,url,image,archive,content,quote,de,en,la,added
fdcdc2165850a02bff8f56a7d3a0f803,2026-03-18T17:24:21Z,'Starkregen',www.morgenpost.de,de,0.9,Kanaren droht Mega-Unwetter – Kachelmann mit dramatischer Prognose,"Sturm, Starkregen und Schnee: Den Kanaren droht eine extreme Wetterwoche – mit mehr als 300 Litern Regen pro Quadratmeter.",https://www.morgenpost.de/panorama/article411497280/kanaren-droht-mega-unwetter-kachelmann-mit-dramatischer-prognose.html,https://img.sparknews.funkemedien.de/411497480/411497480_1773854661_v16_9_1600.jpeg,,"Den Kanarischen Inseln steht eine turbulente Wetterwoche bevor. Wie mehrere Medien, unter anderem Teneriffa-News, berichten, können bis zum Wochenende regional mehr als 300 Liter Regen pro Quadratmet… [+2214 chars]",,"Kanaren droht Mega-Unwetter – Kachelmann mit dramatischer Prognose. Sturm, Starkregen und Schnee: Den Kanaren droht eine extreme Wetterwoche – mit mehr als 300 Litern Regen pro Quadratmeter.","Canary Islands threatened with mega storms – Kachelmann with a dramatic forecast. Storm, heavy rain and snow: The Canary Islands are facing a week of extreme weather - with more than 300 liters of rain per square meter.","Insulae Canariae minatae sunt mega procellis – Kachelmann cum praenuntiatione dramatica. Tempestas, pluvia et nix gravis: Insulae Canariae spectantes hebdomadam extremae tempestatis - cum plus quam CCC liters pluviae per metrum quadratam.",2026-03-21 14:55:45+00:00
689f64d39efba202cd2192bd654f6ff3,2026-03-19T11:32:38Z,'Starkregen',www.morgenpost.de,de,0.9,Unwetter auf Teneriffa – Kachelmann mit dramatischer Prognose,"Sturm, Starkregen und Schnee: Die Kanaren wappnen sich für eine extreme Wetterwoche. Flüge und Fähren könnten betroffen sein",https://www.morgenpost.de/panorama/article411497280/kanarische-inseln-kanaren-unwetter-aktuell-teneriffa-wetter-regen-kachelmann.html,https://img.sparknews.funkemedien.de/411497480/411497480_1773854661_v16_9_1600.jpeg,,"<ul><li>Auf Teneriffa, La Palma, La Gomera und El Hierro werden extreme Regenmengen erwartet</li><li>Schulen und Kindergärten bleiben geschlossen, Inselbewohner sollen zu Hause bleiben</li><li>Flüge … [+3356 chars]",,"Unwetter auf Teneriffa – Kachelmann mit dramatischer Prognose. Sturm, Starkregen und Schnee: Die Kanaren wappnen sich für eine extreme Wetterwoche. Flüge und Fähren könnten betroffen sein","Storm in Tenerife – Kachelmann with a dramatic forecast. Storm, heavy rain and snow: The Canary Islands are preparing for a week of extreme weather. Flights and ferries could be affected","Tempestas in Tenerife – Kachelmann cum scenica praesagio. Tempestas, pluvia et nix: Insulae Canariae septimanam extremae tempestatis parant. Volatus et ferries posse affectus",2026-03-21 14:55:45+00:00
d08200455cf78ad184595ccba8f833f9,2026-03-19T12:15:03Z,'Extremwetter Regen',www.stern.de,de,0.9,"Sturmtief ""Therese"": Kanaren: Kachelmann warnt vor ""Regenmengen, wie sie seit Menschengedenken nicht gefallen sind""",Den Kanarischen Inseln steht eine Extremwetterwoche bevor. Auch Jörg Kachelmann sprach eine deutliche Warnung an Einwohner und Touristen aus. Betroffen sind unter anderem die Inseln Teneriffa und La Palma.,https://www.stern.de/kanaren--kachelmann-warnt-vor--regenmengen--wie-sie-seit-menschengedenken-nicht-gefallen-sind--37236882.html,https://image.stern.de/37236878/t/v6/v1/w1440/r1.7778/-/unwetterwarnung--1-.jpg,,"Kopiere den aktuellen Link
Zur Merkliste hinzufügen
Den Kanarischen Inseln steht eine Extremwetterwoche bevor. Auch Jörg Kachelmann sprach eine deutliche Warnung an Einwohner und Touristen aus. Bet… [+1190 chars]",,"Sturmtief ""Therese"": Kanaren: Kachelmann warnt vor ""Regenmengen, wie sie seit Menschengedenken nicht gefallen sind"". Den Kanarischen Inseln steht eine Extremwetterwoche bevor. Auch Jörg Kachelmann sprach eine deutliche Warnung an Einwohner und Touristen aus. Betroffen sind unter anderem die Inseln Teneriffa und La Palma.",Storm “Therese”: Canary Islands: Kachelmann warns of “amounts of rain that have not fallen in living memory”. The Canary Islands are facing a week of extreme weather. Jörg Kachelmann also issued a clear warning to residents and tourists. The islands of Tenerife and La Palma are among those affected.,"Tempestas ""Teresiae"": Insulae Canariae: Kachelmann monet ""moles pluviarum quae in viva memoria non ceciderunt"". Insulae Canariae spectantes septimanam extremae tempestatis sunt. Jörg Kachelmann etiam claram admonitionem habitantibus et peregrinatoribus edidit. Insulae Nivariae et La Palma inter eas affectae sunt.",2026-03-21 14:55:45+00:00
d5745f1b9301adbe0c3c4ad90a7d2fed,2026-03-20T12:58:43Z,'Starkregen',www.morgenpost.de,de,0.9,Kanaren: Regenmassen erreichen Teneriffa & Co. – dramatische Prognose,"Sturm, Starkregen und Schnee: Die Kanaren werden von schwerem Unwetter heimgesucht. Warnung gilt bis Sonntag. Flüge und Fähren betroffen.",https://www.morgenpost.de/panorama/article411497280/kanaren-teneriffa-unwetter-regen-inseln-kachelmann-sturm-urlaub.html,https://img.sparknews.funkemedien.de/411507475/411507475_1773938629_v16_9_1600.jpeg,,"<ul><li>Auf Teneriffa, La Palma, La Gomera und El Hierro werden extreme Regenmengen erwartet</li><li>Schulen und Kindergärten bleiben geschlossen, Inselbewohner sollen zu Hause bleiben</li><li>Flüge … [+3818 chars]",,"Kanaren: Regenmassen erreichen Teneriffa & Co. – dramatische Prognose. Sturm, Starkregen und Schnee: Die Kanaren werden von schwerem Unwetter heimgesucht. Warnung gilt bis Sonntag. Flüge und Fähren betroffen.","Canary Islands: Rain masses reach Tenerife & Co. – dramatic forecast. Storm, heavy rain and snow: The Canary Islands are hit by severe storms. Warning applies until Sunday. Flights and ferries affected.","Insulae Canariae: Missae pluviales ad Tenerifum & Co. - praenuntiatio dramatica. Tempestas, pluvia et nix: Insulae Canariae gravibus procellis feriuntur. Admonitio ad diem Dominicum. Volatus et ferries affectus.",2026-03-21 14:55:45+00:00
515a12933e0857afed67a70402c332a6,2026-03-21T00:28:19Z,'Extremwetter Regen',www.tagesspiegel.de,de,0.8,Extremwetter: Überschwemmungen auf Hawaii - Tausende verlassen ihre Häuser,Nach starken Regenfällen im US-Bundesstaat Hawaii sind vielerorts Straßen überflutet. Ein Damm droht zu brechen. Tausende Menschen müssen ihre Häuser vorsichtshalber verlassen.,https://www.tagesspiegel.de/gesellschaft/panorama/extremwetter-uberschwemmungen-auf-hawaii-tausende-verlassen-ihre-hauser-15384731.html,https://www.tagesspiegel.de/images/15384730/alternates/BASE_16_9_W1400/1774052899000/uberschwemmungen-in-hawaii.jpeg,,"Nach tagelangen Regenfällen auf Hawaii, die vielerorts zu Überschwemmungen führten, haben die Behörden auf der Insel Oahu Evakuierungen angeordnet. Dort habe der Pegelstand am Wahiawa-Damm einen krit… [+2327 chars]",,Extremwetter: Überschwemmungen auf Hawaii - Tausende verlassen ihre Häuser. Nach starken Regenfällen im US-Bundesstaat Hawaii sind vielerorts Straßen überflutet. Ein Damm droht zu brechen. Tausende Menschen müssen ihre Häuser vorsichtshalber verlassen.,"Extreme weather: Floods in Hawaii - thousands leave their homes. After heavy rain in the US state of Hawaii, streets are flooded in many places. A dam is in danger of breaking. Thousands of people have to leave their homes as a precaution.",Extrema tempestas: diluvia in Hawaii - mille domos suas relinquunt. Post pluviam in Civitate Hawaii multae pluviae multis locis inundatae sunt. A matre in periculo fractionis. Millia hominum habent ad cautelam sedibus suis relinquunt.,2026-03-22 20:55:06+00:00
91dab20bdf9bdf0180a410490c8d409a,2026-03-21T00:26:00Z,'Extremwetter Regen',www.stern.de,de,0.8,Extremwetter: Überschwemmungen auf Hawaii - Tausende verlassen ihre Häuser,Nach starken Regenfällen im US-Bundesstaat Hawaii sind vielerorts Straßen überflutet. Ein Damm droht zu brechen. Tausende Menschen müssen ihre Häuser vorsichtshalber verlassen.,https://www.stern.de/panorama/extremwetter--ueberschwemmungen-auf-hawaii---tausende-verlassen-ihre-haeuser-37241606.html,https://image.stern.de/37241608/t/LV/v1/w1440/r1.7778/-/21--fov6sfexzjv10axs2048jpeg---a4b348c3940ab883.jpg,,"Kopiere den aktuellen Link
Zur Merkliste hinzufügen
Nach starken Regenfällen im US-Bundesstaat Hawaii sind vielerorts Straßen überflutet. Ein Damm droht zu brechen. Tausende Menschen müssen ihre Hä… [+1127 chars]",,Extremwetter: Überschwemmungen auf Hawaii - Tausende verlassen ihre Häuser. Nach starken Regenfällen im US-Bundesstaat Hawaii sind vielerorts Straßen überflutet. Ein Damm droht zu brechen. Tausende Menschen müssen ihre Häuser vorsichtshalber verlassen.,"Extreme weather: Floods in Hawaii - thousands leave their homes. After heavy rain in the US state of Hawaii, streets are flooded in many places. A dam is in danger of breaking. Thousands of people have to leave their homes as a precaution.",Extrema tempestas: diluvia in Hawaii - mille domos suas relinquunt. Post pluviam in Civitate Hawaii multae pluviae multis locis inundatae sunt. A matre in periculo fractionis. Millia hominum habent ad cautelam sedibus suis relinquunt.,2026-03-23 21:06:00+00:00
010a288eaced4bdadde1c1d35860ab5c,2026-03-22T20:52:07Z,'Starkregen',www.morgenpost.de,de,0.9,Regenmassen verwüsten Teneriffa & Co. – Doch die Bevölkerung ist glücklich,"Sturm, Starkregen und Schnee: Die Kanaren wurden von schwerem Unwetter heimgesucht. Doch für die Landwirtschaft war es ein Glücksfall.",https://www.morgenpost.de/panorama/article411497280/kanaren-teneriffa-gran-canaria-unwetter-regen-inseln-kachelmann-sturm-urlaub.html,https://img.sparknews.funkemedien.de/411521218/411521218_1774212727_v16_9_1600.jpeg,,"<ul><li>Auf Teneriffa, La Palma, La Gomera und El Hierro wurden extreme Regenmengen erwartet</li><li>Schulen und Kindergärten blieben geschlossen, Inselbewohner sollten zu Hause bleiben</li><li>Doch … [+4717 chars]",,"Regenmassen verwüsten Teneriffa & Co. – Doch die Bevölkerung ist glücklich. Sturm, Starkregen und Schnee: Die Kanaren wurden von schwerem Unwetter heimgesucht. Doch für die Landwirtschaft war es ein Glücksfall.","Mass amounts of rain devastate Tenerife & Co. – But the population is happy. Storm, heavy rain and snow: The Canary Islands were hit by severe storms. But it was a stroke of luck for agriculture.","Moles pluviae vastant Tenerifum & Co. – Plebs autem laeta est. Tempestas, pluvia et nix: Insulae Canariae gravibus procellis sunt percussae. Sed ictus felicis agriculturae fuit.",2026-03-24 15:44:07+00:00
ed19f6b18e788c6f0db6f83cc09f101f,2026-03-23T02:34:57Z,'Überflutung Regen',www.welt.de,de,0.8,Sintflutartige Regenfälle auf Hawaii – Tausende ohne Strom,"Heftige Regenfälle lösen auf Hawaii die schlimmsten Überflutungen seit Jahrzehnten aus. Tausende Menschen müssen ihre Häuser verlassen, ein Damm droht zu brechen. Das volle Ausmaß der Schäden ist noch unklar.",https://www.welt.de/vermischtes/article69c0a16d8f5761671715bed0/hawaii-sintflutartige-regenfaelle-tausende-ohne-strom.html,https://images.welt.de/69c0a16d8f5761671715bed0/3c37f134656136a3ce3968f840b5674b-master/ci16x9-w1200/1774163388681-afp-a4944zq-jpg,,"Heftige Regenfälle lösen auf Hawaii die schlimmsten Überflutungen seit Jahrzehnten aus. Tausende Menschen müssen ihre Häuser verlassen, ein Damm droht zu brechen. Das volle Ausmaß der Schäden ist noc… [+2035 chars]",,"Sintflutartige Regenfälle auf Hawaii – Tausende ohne Strom. Heftige Regenfälle lösen auf Hawaii die schlimmsten Überflutungen seit Jahrzehnten aus. Tausende Menschen müssen ihre Häuser verlassen, ein Damm droht zu brechen. Das volle Ausmaß der Schäden ist noch unklar.",Torrential rains in Hawaii – thousands without power. Heavy rains trigger the worst flooding in decades in Hawaii. Thousands of people have to leave their homes and a dam is in danger of breaking. The full extent of the damage is still unclear.,Imbres torrentes in Hawaii - milia sine potentia. Imbres graves trigger pessimi inundationem in decenniis Hawaii. Milia hominum domos suas exeunt et a matre in periculo solvendi sunt. Amplitudo damni adhuc lateat.,2026-03-24 21:08:14+00:00
91bd5dc4d26652e1fd38ca468e6f4d47,2026-03-17T05:08:22Z,'Unwetter Regen',www.tagesspiegel.de,de,0.8,Unwetter in der Wüste: Rekordregen in Australiens Zentrum - Wasserfälle am Uluru,Plötzlich rauschen Wasserfälle vom Uluru: Nach dem stärksten Regen seit zehn Jahren erleben Besucher das Naturwunder ganz anders – und sollten jetzt besonders vorsichtig sein.,https://www.tagesspiegel.de/gesellschaft/panorama/unwetter-in-der-wuste-rekordregen-in-australiens-zentrum-wasserfalle-am-uluru-15366036.html,https://www.tagesspiegel.de/images/15366035/alternates/BASE_16_9_W1400/1773724102000/hochwasser-in-australien.jpeg,,Nach Rekordregenfällen im Zentrum von Australien und speziell rund um den berühmten Felsen Uluru haben die Behörden Warnungen an Touristen ausgegeben. Die Regenmenge der vergangenen zwei Tage entspre… [+1857 chars],,Unwetter in der Wüste: Rekordregen in Australiens Zentrum - Wasserfälle am Uluru. Plötzlich rauschen Wasserfälle vom Uluru: Nach dem stärksten Regen seit zehn Jahren erleben Besucher das Naturwunder ganz anders – und sollten jetzt besonders vorsichtig sein.,"Storms in the desert: record rainfall in central Australia - waterfalls at Uluru. Suddenly waterfalls rush from Uluru: After the heaviest rain in ten years, visitors experience the natural wonder in a completely different way - and should now be particularly careful.","Tempestates in solitudinibus: recordatio pluviarum in Australia centrali - cataractarum in Uluru. Subito cataractae ruunt ab Uluru: Post pluviam gravissimam in decem annis, visitatores naturalem admirationem omnino aliter sentiunt - et nunc maxime cavent.",2026-04-14 11:43:29+00:00
56dbf69274682b872456ce88aa5d2f43,2026-03-23T07:56:17Z,'Unwetter Regen',www.stern.de,de,0.8,Unwetter: Jason Momoa flieht vor Fluten auf Hawaii,"Tagelange Regenfälle und Überschwemmungen zwingen Schauspieler Jason Momoa dazu, die Nordküste der Insel Oahu zu verlassen. Auf Instagram verkündet er: ""Wir sind jetzt sicher"".",https://www.stern.de/lifestyle/leute/unwetter--jason-momoa-flieht-vor-fluten-auf-hawaii-37245718.html,https://image.stern.de/37245720/t/oc/v1/w1440/r1.7778/-/23--6orom4yj57v4axs2048jpeg---0768902c0b97c76d.jpg,,"Kopiere den aktuellen Link
Zur Merkliste hinzufügen
Tagelange Regenfälle und Überschwemmungen zwingen Schauspieler Jason Momoa dazu, die Nordküste der Insel Oahu zu verlassen. Auf Instagram verkünd… [+1138 chars]",,"Unwetter: Jason Momoa flieht vor Fluten auf Hawaii. Tagelange Regenfälle und Überschwemmungen zwingen Schauspieler Jason Momoa dazu, die Nordküste der Insel Oahu zu verlassen. Auf Instagram verkündet er: ""Wir sind jetzt sicher"".",Storm: Jason Momoa flees floods in Hawaii. Days of rain and flooding force actor Jason Momoa to leave the north shore of Oahu. He announced on Instagram: “We are safe now.”,"Storm: Jason Momoa in Hawaii inundationes fugit. Diebus pluviae et inundationis vis actor Iason Momoa discedere ad litus septentrionalis Oahu. Annuntiavit super Instagram: ""nunc salvi sumus.""",2026-04-14 11:43:29+00:00
b9747a371ca6e27988674651909a117a,2026-03-23T07:57:30Z,'Unwetter Regen',www.tagesspiegel.de,de,0.8,Unwetter: Jason Momoa flieht vor Fluten auf Hawaii,"Tagelange Regenfälle und Überschwemmungen zwingen Schauspieler Jason Momoa dazu, die Nordküste der Insel Oahu zu verlassen. Auf Instagram verkündet er: „Wir sind jetzt sicher“.",https://www.tagesspiegel.de/gesellschaft/unwetter-jason-momoa-flieht-vor-fluten-auf-hawaii-15388816.html,https://www.tagesspiegel.de/images/15388815/alternates/BASE_16_9_W1400/1774252650000/weltpremiere-ein-minecraft-film-in-london.jpeg,,"Schauspieler Jason Momoa ist vor den Fluten auf Hawaii geflüchtet. Ich habe meine Familie bei mir. Wir sind aus der North Shore herausgekommen, viele haben gefragt, sagte der 46-Jährige in einem Vide… [+990 chars]",,"Unwetter: Jason Momoa flieht vor Fluten auf Hawaii. Tagelange Regenfälle und Überschwemmungen zwingen Schauspieler Jason Momoa dazu, die Nordküste der Insel Oahu zu verlassen. Auf Instagram verkündet er: „Wir sind jetzt sicher“.",Storm: Jason Momoa flees floods in Hawaii. Days of rain and flooding force actor Jason Momoa to leave the north shore of Oahu. He announced on Instagram: “We are safe now.”,"Storm: Jason Momoa in Hawaii inundationes fugit. Diebus pluviae et inundationis vis actor Iason Momoa discedere ad litus septentrionalis Oahu. Annuntiavit super Instagram: ""nunc salvi sumus.""",2026-04-14 11:43:29+00:00
eba12821b25a7be548488add02ef7bd7,2026-03-17T05:07:11Z,'Überflutung Regen',www.stern.de,de,0.8,Unwetter in der Wüste: Rekordregen in Australiens Zentrum - Wasserfälle am Uluru,Plötzlich rauschen Wasserfälle vom Uluru: Nach dem stärksten Regen seit zehn Jahren erleben Besucher das Naturwunder ganz anders – und sollten jetzt besonders vorsichtig sein.,https://www.stern.de/panorama/unwetter-in-der-wueste--rekordregen-in-australiens-zentrum---wasserfaelle-am-uluru-37227384.html,https://image.stern.de/37227386/t/e-/v1/w1440/r1.7778/-/17--rs5hh27ql4v6axs2048jpeg---42872791de2d4b5c.jpg,http://web.archive.org/web/20260318005740/https://www.stern.de/panorama/unwetter-in-der-wueste--rekordregen-in-australiens-zentrum---wasserfaelle-am-uluru-37227384.html,"Kopiere den aktuellen Link
Zur Merkliste hinzufügen
Plötzlich rauschen Wasserfälle vom Uluru: Nach dem stärksten Regen seit zehn Jahren erleben Besucher das Naturwunder ganz anders und sollten jetz… [+1321 chars]",,Unwetter in der Wüste: Rekordregen in Australiens Zentrum - Wasserfälle am Uluru. Plötzlich rauschen Wasserfälle vom Uluru: Nach dem stärksten Regen seit zehn Jahren erleben Besucher das Naturwunder ganz anders – und sollten jetzt besonders vorsichtig sein.,"Storms in the desert: record rainfall in central Australia - waterfalls at Uluru. Suddenly waterfalls rush from Uluru: After the heaviest rain in ten years, visitors experience the natural wonder in a completely different way - and should now be particularly careful.","Tempestates in solitudinibus: recordatio pluviarum in Australia centrali - cataractarum in Uluru. Subito cataractae ruunt ab Uluru: Post pluviam gravissimam in decem annis, visitatores naturalem admirationem omnino aliter sentiunt - et nunc maxime cavent.",2026-04-14 15:53:25+00:00
fd7316469876d271b1e64087145fb6f8,2026-03-23T02:34:57Z,'Überflutung Regen',www.welt.de,de,0.8,Sintflutartige Regenfälle – Hawaii von schwersten Überschwemmungen seit 20 Jahren betroffen,"Heftige Regenfälle lösen auf Hawaii die schlimmsten Überflutungen seit Jahrzehnten aus. Tausende Menschen müssen ihre Häuser verlassen, ein Damm droht zu brechen. Das volle Ausmaß der Schäden ist noch unklar.",https://www.welt.de/vermischtes/article69c0a16d8f5761671715bed0/hawaii-schlimmste-ueberschwemmungen-seit-mehr-als-20-jahren.html,https://images.welt.de/69c0a16d8f5761671715bed0/3c37f134656136a3ce3968f840b5674b-master/ci16x9-w1200/1774163388681-afp-a4944zq-jpg,,"Heftige Regenfälle lösen auf Hawaii die schlimmsten Überflutungen seit Jahrzehnten aus. Tausende Menschen müssen ihre Häuser verlassen, ein Damm droht zu brechen. Das volle Ausmaß der Schäden ist noc… [+2035 chars]",,"Sintflutartige Regenfälle – Hawaii von schwersten Überschwemmungen seit 20 Jahren betroffen. Heftige Regenfälle lösen auf Hawaii die schlimmsten Überflutungen seit Jahrzehnten aus. Tausende Menschen müssen ihre Häuser verlassen, ein Damm droht zu brechen. Das volle Ausmaß der Schäden ist noch unklar.",Torrential rains – Hawaii hit by worst flooding in 20 years. Heavy rains trigger the worst flooding in decades in Hawaii. Thousands of people have to leave their homes and a dam is in danger of breaking. The full extent of the damage is still unclear.,Imbrium torrentium - Hawaii ictus pessimi inundationem in XX annis. Imbres graves trigger pessimi inundationem in decenniis Hawaii. Milia hominum domos suas exeunt et a matre in periculo solvendi sunt. Amplitudo damni adhuc lateat.,2026-04-14 21:27:54+00:00
90d4452b09838fc00f897b5d3552f916,2026-03-25T14:12:23Z,'Hochwasser Regen',hallespektrum.de,de,0.8,Hochwasser-Alarm in Halle und Magdeburg: Fehlalarm durch Systemumstellung,"Halle/Magdeburg. – Am Mittwoch, den 25. März 2026, sorgte eine Hochwasser-Vorwarnung in der NINA-Warn-App kurzfristig für Verwirrung in Halle und Magdeburg. Viele Nutzerinnen und Nutzer erhielten die Meldung, obwohl weder Regen noch Hochwasser zu erwarten war…",https://hallespektrum.de/aktuelles/hochwasser-alarm-in-halle-und-magdeburg-fehlalarm-durch-systemumstellung/476130/,https://hallespektrum.de/wp-content/uploads/2023/12/Hochwasser.jpg,,"Halle/Magdeburg. Am Mittwoch, den 25. März 2026, sorgte eine Hochwasser-Vorwarnung in der NINA-Warn-App kurzfristig für Verwirrung in Halle und Magdeburg. Viele Nutzerinnen und Nutzer erhielten die M… [+684 chars]",,"Hochwasser-Alarm in Halle und Magdeburg: Fehlalarm durch Systemumstellung. Halle/Magdeburg. – Am Mittwoch, den 25. März 2026, sorgte eine Hochwasser-Vorwarnung in der NINA-Warn-App kurzfristig für Verwirrung in Halle und Magdeburg. Viele Nutzerinnen und Nutzer erhielten die Meldung, obwohl weder Regen noch Hochwasser zu erwarten war…","Flood alarm in Halle and Magdeburg: false alarm due to system change. Halle/Magdeburg. - On Wednesday, March 25, 2026, a flood warning in the NINA warning app caused short-term confusion in Halle and Magdeburg. Many users received the message even though neither rain nor flooding was expected...","Trepidatio diluvii in Halle et Magdeburg: terror falsus ob mutationis ratio. Halle/Magdeburg. - Die Mercurii, die 25 mensis Martii, anno 2026, diluvium admonitio in NINA app monitus breve tempus tumultum in Halle et Magdeburg effecit. Multi users nuntium receperunt etsi nec pluvia nec inundatio exspectabatur...",2026-04-14 21:27:54+00:00
