index,published,keyword,domain,language,valid,title,description,url,image,archive,content,quote,de,en,la,added
65785500a96d6e8d9ae62db1bd43040e,2026-07-01T09:23:41Z,'Unwetterwarnung',www.zeit.de,de,0.9,Warnung vor Sturm und Hagel: Abfertigungsstopp am Münchner Flughafen nach Unwetterwarnung,Hier finden Sie Informationen zu dem Thema „Warnung vor Sturm und Hagel“. Lesen Sie jetzt „Abfertigungsstopp am Münchner Flughafen nach Unwetterwarnung“.,https://www.zeit.de/news/2026-07/01/abfertigungsstopp-am-muenchner-flughafen-nach-unwetterwarnung,https://img.zeit.de/news/2026-07/01/abfertigungsstopp-am-muenchner-flughafen-nach-unwetterwarnung-image-group/wide__1300x731,,"Wegen einer Unwetterwarnung werden am Münchner Flughafen vorerst keine Maschinen abgefertigt. Der Abfertigungsbetrieb sei vorerst eingestellt, teilte der Flughafen per Durchsage vor Ort mit. 
Aufgru… [+415 chars]",,Warnung vor Sturm und Hagel: Abfertigungsstopp am Münchner Flughafen nach Unwetterwarnung. Hier finden Sie Informationen zu dem Thema „Warnung vor Sturm und Hagel“. Lesen Sie jetzt „Abfertigungsstopp am Münchner Flughafen nach Unwetterwarnung“.,Warning of storms and hail: check-in stop at Munich Airport after a severe weather warning. Here you will find information on the topic “Warning about storms and hail”. Now read “Check-in stop at Munich Airport after severe weather warning”.,"Monitum procellarum et grandinum: perscriptio in statione apud Airport Munich post tempestatem gravem admonitionem. Hic informationes invenies in themate ""Admonitio de procellis et grandinibus"". Nunc legitur ""Reprehendo-in statur apud Munich Airport post tempestatem gravem admonitionem"".",2026-07-03 06:49:16+00:00
a56a5b9f861cb74a9441a1b730596a17,2026-07-01T09:24:50Z,'Unwetterwarnung',www.tagesspiegel.de,de,0.9,Wetter: Abfertigungsstopp am Münchner Flughafen nach Unwetterwarnung,Seit Tagen ziehen immer wieder teils schwere Gewitter über Bayern. Am Münchner Flughafen wurden nun Maschinen ausgebremst.,https://www.tagesspiegel.de/gesellschaft/panorama/wetter-abfertigungsstopp-am-munchner-flughafen-nach-unwetterwarnung-15780952.html,https://www.tagesspiegel.de/images/15781444/alternates/BASE_16_9_W1400/1782902506000/abfertigungsstopp-am-munchner-flughafen-nach-unwetterwarnung.jpeg,http://web.archive.org/web/20260702074454/https://www.tagesspiegel.de/gesellschaft/panorama/wetter-abfertigungsstopp-am-munchner-flughafen-nach-unwetterwarnung-15780952.html,"Nach einer Unwetterwarnung sind am Münchner Flughafen am Vormittag zeitweise keine Maschinen abgefertigt worden. Wegen der Wetterlage sei für 30 Minuten ein Abfertigungsstopp ausgerufen worden, teilt… [+916 chars]",,Wetter: Abfertigungsstopp am Münchner Flughafen nach Unwetterwarnung. Seit Tagen ziehen immer wieder teils schwere Gewitter über Bayern. Am Münchner Flughafen wurden nun Maschinen ausgebremst.,Weather: Check-in stop at Munich airport after severe weather warning. Severe thunderstorms have been raging across Bavaria for days. Machines have now been slowed down at Munich Airport.,Tempestas: Check-in stop ad aeroportus Monacensis cum gravibus tempestatibus admonitio. Gravibus tonitribus trans Bavariam diebus saeviebant. Machinae nunc apud Airport Munich retardatae sunt.,2026-07-03 06:49:16+00:00
894dda3f7b2b474d12157372118959de,2026-07-01T09:24:50Z,'Unwetterwarnung',www.tagesspiegel.de,de,0.9,Warnung vor Sturm und Hagel: Abfertigungsstopp am Münchner Flughafen nach Unwetterwarnung,Seit Tagen ziehen immer wieder teils schwere Gewitter über Bayern. Wegen einer Unwetterwarnung werden jetzt auch Maschinen am Münchner Flughafen ausgebremst.,https://www.tagesspiegel.de/gesellschaft/panorama/warnung-vor-sturm-und-hagel-abfertigungsstopp-am-munchner-flughafen-nach-unwetterwarnung-15780952.html,https://www.tagesspiegel.de/images/15780951/alternates/BASE_16_9_W1400/1782897890000/munchner-flughafen.jpeg,,"Wegen einer Unwetterwarnung werden am Münchner Flughafen vorerst keine Maschinen abgefertigt. Der Abfertigungsbetrieb sei vorerst eingestellt, teilte der Flughafen per Durchsage vor Ort mit. 
Aufgru… [+469 chars]",,Warnung vor Sturm und Hagel: Abfertigungsstopp am Münchner Flughafen nach Unwetterwarnung. Seit Tagen ziehen immer wieder teils schwere Gewitter über Bayern. Wegen einer Unwetterwarnung werden jetzt auch Maschinen am Münchner Flughafen ausgebremst.,"Warning of storms and hail: check-in stop at Munich Airport after a severe weather warning. Severe thunderstorms have been raging across Bavaria for days. Due to a severe weather warning, machines at Munich Airport are now also being slowed down.","Monitum procellarum et grandinum: perscriptio in statione apud Airport Munich post tempestatem gravem admonitionem. Gravibus tonitribus trans Bavariam diebus saeviebant. Ob tempestatem gravem monendo, machinae apud Airport Munich etiam nunc retardatae sunt.",2026-07-03 06:49:16+00:00
9094bd6d85a820cea3a9cbe9dafc5b56,2026-07-01T09:39:34Z,'Unwetterwarnung',www.sueddeutsche.de,de,0.9,Sturm und Hagel: Abfertigungsstopp am Münchner Flughafen nach Unwetterwarnung,Seit Tagen ziehen immer wieder teils schwere Gewitter über Bayern. Wegen einer Unwetterwarnung werden jetzt auch Maschinen am Münchner Flughafen ausgebremst.,https://www.sueddeutsche.de/muenchen/flughafen-muenchen-unwetter-abfertigung-stopp-li.3508560,https://www.sueddeutsche.de/2026/07/01/9b785ce2-8063-49b9-a731-469777b3069b.jpg?q=60&fm=webp&width=1200&rect=0%2C205%2C4000%2C2250,,"Wegen einer Unwetterwarnung werden am Münchner Flughafen vorerst keine Maschinen abgefertigt. Der Abfertigungsbetrieb sei vorerst eingestellt, teilte der Flughafen per Durchsage vor Ort mit.Aufgrund … [+368 chars]",,Sturm und Hagel: Abfertigungsstopp am Münchner Flughafen nach Unwetterwarnung. Seit Tagen ziehen immer wieder teils schwere Gewitter über Bayern. Wegen einer Unwetterwarnung werden jetzt auch Maschinen am Münchner Flughafen ausgebremst.,"Storm and hail: check-in stop at Munich airport after severe weather warning. Severe thunderstorms have been raging across Bavaria for days. Due to a severe weather warning, machines at Munich Airport are now also being slowed down.","Tempestas et grando: in aeroportus Monacensis apud moras-reprehendo post tempestatem gravem admonitionem. Gravibus tonitribus trans Bavariam diebus saeviebant. Ob tempestatem gravem monendo, machinae apud Airport Munich etiam nunc retardatae sunt.",2026-07-03 06:49:16+00:00
fa44d035b3ce80fd14c2091ff075daaa,2026-07-01T17:00:48Z,'Unwetterwarnung',www.morgenpost.de,de,0.9,Unwetterwarnung kurz vor Foo-Fighters-Konzert in Berlin – Beginn unklar,"Kurz vor dem geplanten Auftritt um 19 Uhr wird vor Unwetter gewarnt. Wann das Konzert starten kann, ist noch offen. News im Blog.",https://www.morgenpost.de/berlin/article412346994/wetter-berlin-aktuell-news-warnungen-gewitter-unwetter-foo-fighters-olympiastadion.html,https://img.sparknews.funkemedien.de/412454875/412454875_1782925286_v16_9_1600.jpeg,,Stresstest für Straßen: Neben den erheblichen Hitzeschäden auf Autobahnen waren auch Landesstraßen in Brandenburg betroffen. Die Straßenmeistereien waren laut Verkehrsministerium auf die extremen Tem… [+1430 chars],,"Unwetterwarnung kurz vor Foo-Fighters-Konzert in Berlin – Beginn unklar. Kurz vor dem geplanten Auftritt um 19 Uhr wird vor Unwetter gewarnt. Wann das Konzert starten kann, ist noch offen. News im Blog.",Storm warning shortly before the Foo Fighters concert in Berlin - beginning unclear. Shortly before the planned performance at 7 p.m. there is a warning about severe weather. It is still unclear when the concert can start. News in the blog.,Tempestas monitum paulo ante Foo Pugnatores concentus Berolinensi - initium latens est. Paulo ante ad VII a.m. cavetur de tempestatibus gravibus. Incertum est adhuc quando concentus incipere potest. News in diario.,2026-07-03 06:49:16+00:00
f63629317b66997c0d2fd545afa48ffc,2026-07-01T22:49:53Z,'Unwetterwarnung',www.morgenpost.de,de,0.9,Die Foo Fighters rocken im Olympiastadion das Gewitter weg,Die Show von Dave Grohl und seiner Band stand zwischendurch wegen einer Unwetterwarnung auf der Kippe. Dann wurde es ein heißer Abend.,https://www.morgenpost.de/kultur/article412447497/die-foo-fighters-rocken-im-olympiastadion-das-gewitter-weg.html,https://img.sparknews.funkemedien.de/412447358/412447358_1782945494_v16_9_1600.jpeg,,"Eine dichte rote Nebelwand versperrt im Berliner Olympiastadion die Sicht auf die Bühne. Es sind am Mittwochabend aber keine Hertha-Hools, die gezündelt haben. Die großzügig gezündete Pyrotechnik mar… [+3359 chars]",,Die Foo Fighters rocken im Olympiastadion das Gewitter weg. Die Show von Dave Grohl und seiner Band stand zwischendurch wegen einer Unwetterwarnung auf der Kippe. Dann wurde es ein heißer Abend.,The Foo Fighters rock the storm in the Olympic Stadium. Dave Grohl and his band's show was temporarily canceled due to a severe weather warning. Then it became a hot evening.,Foo Pugnatores tempestas in Stadio Olympico lapis. Dave Grohl et spectaculum cohortis eius ad tempus remissum est propter magnam tempestatem admonitionem. Tunc incalescit vespera.,2026-07-03 06:49:16+00:00
ec00b4481862192282da04d1adf9ea8a,2026-07-01T05:41:39Z,'Kanalisation Regen',www.zeit.de,de,0.9,Unwetter-Folgen: Starkregen überflutet Straßen – Zugverkehr lahmgelegt,Hier finden Sie Informationen zu dem Thema „Unwetter-Folgen“. Lesen Sie jetzt „Starkregen überflutet Straßen – Zugverkehr lahmgelegt“.,https://www.zeit.de/news/2026-07/01/starkregen-ueberflutet-strassen-zugverkehr-lahmgelegt,https://img.zeit.de/news/2026-07/01/starkregen-ueberflutet-strassen-zugverkehr-lahmgelegt-image-group/wide__1300x731,,"Teils heftige Gewitter und Starkregen haben den Einsatzkräften in mehreren Regionen Bayerns eine geschäftige Nacht beschert. Vor allem in Oberfranken, Unterfranken und Oberbayern seien einige Bäume u… [+1176 chars]",,Unwetter-Folgen: Starkregen überflutet Straßen – Zugverkehr lahmgelegt. Hier finden Sie Informationen zu dem Thema „Unwetter-Folgen“. Lesen Sie jetzt „Starkregen überflutet Straßen – Zugverkehr lahmgelegt“.,Storm consequences: Heavy rain floods streets - train traffic paralyzed. Here you will find information on the topic of “Severe Weather Consequences”. Now read “Heavy rain floods streets – train traffic paralyzed”.,"Tempestas consectaria: Gravis inundationes platearum pluviarum - tramen negotiationis paralytici. Hic informationes invenies in argumento ""Seves Tempestatis euentuum"". Nunc lege ""Graves pluviae inundationes platearum - comitatu negotiationis paralytici"".",2026-07-03 16:08:54+00:00
d6acf154d49e425f9c1873c76b809143,2026-07-01T06:12:49Z,'Kanalisation Regen',www.sueddeutsche.de,de,0.9,Wetter in Bayern: Nach erneuten Überschwemmungen: Es bleibt gewittrig,Unwetter mit Starkregen lassen wieder Unterführungen und Keller volllaufen. Besonders im Fränkischen haben die Einsatzkräfte gut zu tun. Und vorläufig bleibt es auch so ungemütlich.,https://www.sueddeutsche.de/bayern/unwetter-bayern-vorhersage-gewitter-regen-li.3508439,https://www.sueddeutsche.de/2026/06/30/96f0057a-9e90-4904-af72-ab08d9a25a8e.jpg?q=60&fm=webp&width=1200&rect=0%2C0%2C3840%2C2160,http://web.archive.org/web/20260701075629/https://www.sueddeutsche.de/bayern/unwetter-bayern-vorhersage-gewitter-regen-li.3508439,"Heute gibt es dem DWD zufolge zunächst in Schwaben, im weiteren Tagesverlauf von West nach Ost verbreitet kräftige Regenfälle und Gewitter mit Sturmböen. Schwerpunktmäßig im Süden könne es dabei Star… [+1839 chars]",,Wetter in Bayern: Nach erneuten Überschwemmungen: Es bleibt gewittrig. Unwetter mit Starkregen lassen wieder Unterführungen und Keller volllaufen. Besonders im Fränkischen haben die Einsatzkräfte gut zu tun. Und vorläufig bleibt es auch so ungemütlich.,"Weather in Bavaria: After renewed flooding: It remains thundery. Storms with heavy rain are causing underpasses and basements to fill up again. The emergency services have a lot to do, especially in Franconia. And for now it remains uncomfortable.","Tempestas in Bavaria: Post renovatum inundationem: Restat tonitruum. Tempestates cum pluvia magna underpasses et bases iterum implent. Multa officia exigentiae habent, praesertim in Franconia. Et nunc incommoditas manet.",2026-07-03 16:08:54+00:00
1db07a19e8f39d588dc81c96440c99da,2026-07-01T00:44:27Z,'Starkregen',www.bild.de,de,0.9,Gewitter und Starkregen - Anpfiff von WM-Spiel verschoben!,WM 2026: Verzögerung in der Runde der letzten 32! Der Anpfiff des Spiels Mexiko gegen Ecuador wurde verschoben.,https://www.bild.de/sport/fussball/unwetter-am-stadion-anpfiff-des-spiels-mexiko-ecuador-verschoben-6a445f17c04ea97a4e5034a0,"https://images.bild.de/6a445f17c04ea97a4e5034a0/244ff41ef3f6de7d2b4297abf25d3ad6,f7f8c55e?w=1280",http://web.archive.org/web/20260702064032/https://www.bild.de/sport/fussball/unwetter-am-stadion-anpfiff-des-spiels-mexiko-ecuador-verschoben-6a445f17c04ea97a4e5034a0,"+++Gewitter und heftiger Regen! Mexiko-Spiel wird später angepfiffen
+++Gewitter und heftiger Regen! Mexiko-Spiel wird später angepfiffen
+++Gewitter und heftiger Regen! Mexiko-Spiel wird später an… [+498 chars]",,Gewitter und Starkregen - Anpfiff von WM-Spiel verschoben!. WM 2026: Verzögerung in der Runde der letzten 32! Der Anpfiff des Spiels Mexiko gegen Ecuador wurde verschoben.,Thunderstorms and heavy rain - kick-off of World Cup game postponed! World Cup 2026: Delay in the round of 32! The kick-off of the Mexico-Ecuador game has been postponed.,Tonitruum et pluviae graves - calcitrant-off of World Cup game differed! Trophaeum Mundi 2026: in circuitu 32: mora! Calciarium ludum Ecuador Mexici differtur.,2026-07-03 21:42:10+00:00
42e370d1c470b3124e8b20e880e4d8dc,2026-07-01T01:49:46Z,'Starkregen',www.bild.de,de,0.9,Unwetter-Chaos - WM-Spiel kann nicht pünktlich beginnen!,Heftiges Gewitter und Starkregen sorgen bei der WM 2026 für eine Spielverzögerung. Der Anpfiff zwischen Mexiko und Ecuador muss kurzfristig um eine Stunde verschoben werden.,https://www.bild.de/sport/fussball/wm-2026-unwetter-chaos-anpfiff-von-wm-spiel-verschoben-6a446843c04ea97a4e5034de,"https://images.bild.de/6a446843c04ea97a4e5034de/0c5b4927cb234c9bc6de4bbac5ea3430,9de04f94?w=1280",,"TTS-Player überspringenArtikel weiterlesenDas Wetter sorgt bei der 
WM 2026 erneut für Probleme! Das Sechzehntelfinale zwischen Mexiko und Ecuador im Azteken-Stadion in Mexiko-Stadt kann nicht wie g… [+1378 chars]",,Unwetter-Chaos - WM-Spiel kann nicht pünktlich beginnen!. Heftiges Gewitter und Starkregen sorgen bei der WM 2026 für eine Spielverzögerung. Der Anpfiff zwischen Mexiko und Ecuador muss kurzfristig um eine Stunde verschoben werden.,Storm chaos - World Cup game cannot start on time! Heavy thunderstorms and heavy rain are causing a delay in the game at the 2026 World Cup. The kick-off between Mexico and Ecuador has to be postponed by one hour at short notice.,Tempestas chaos - World Cup ludum non potest incipere in tempore! Tempestates graves et pluviae graves moras causant in ludo 2026 World Cup. Calciamentum inter Mexicum et Aequatorem una hora celeriter prorogandum est.,2026-07-05 06:56:16+00:00
c977418f9fbab3a6d74f176a09913cba,2026-07-01T04:30:41Z,'Starkregen',www.tagesspiegel.de,de,0.9,Wetterausblick: Wo am Mittwoch neue Gewitter drohen,"Erneut drohen Gewitter in der Bundesrepublik – mit Starkregen, Hagel und Sturmböen. Das erwartet der Deutsche Wetterdienst.",https://www.tagesspiegel.de/gesellschaft/panorama/wetterausblick-wo-am-mittwoch-neue-gewitter-drohen-15779621.html,https://www.tagesspiegel.de/images/15779620/alternates/BASE_16_9_W1400/1782880241000/gewitter-uber-brandenburg.jpeg,,"Wer am Mittwoch unterwegs ist, sollte den Himmel im Blick behalten: Nach Vorhersage des Deutschen Wetterdienstes (DWD) könnten erneut Gewitter über Teile Deutschlands ziehen. Erwartbar sind sie bis z… [+734 chars]",,"Wetterausblick: Wo am Mittwoch neue Gewitter drohen. Erneut drohen Gewitter in der Bundesrepublik – mit Starkregen, Hagel und Sturmböen. Das erwartet der Deutsche Wetterdienst.","Weather outlook: Where new thunderstorms are threatening on Wednesday. Thunderstorms are threatening again in the Federal Republic - with heavy rain, hail and squalls. This is what the German Weather Service expects.","Tempestas prospectans: Ubi novi tonitrui die Mercurii minantur. Tempestates iterum minantur in Republica Foederata - cum pluvia, grandine et procellis. Hoc est quod Expectat Service Tempestas Germanica.",2026-07-05 06:56:16+00:00
19f97935f92f08174cad1bdfce51a1de,2026-07-01T10:48:37Z,'Starkregen',www.zeit.de,de,0.9,Starkregen: Auto bleibt in überfluteter Unterführung stecken,Hier finden Sie Informationen zu dem Thema „Starkregen“. Lesen Sie jetzt „Auto bleibt in überfluteter Unterführung stecken“.,https://www.zeit.de/news/2026-07/01/auto-bleibt-in-ueberfluteter-unterfuehrung-stecken,https://img.zeit.de/news/2026-07/01/auto-bleibt-in-ueberfluteter-unterfuehrung-stecken-image-group/wide__1300x731,,Ein Autofahrer ist von der Feuerwehr aus einer überfluteten Unterführung befreit worden. Durch den Starkregen habe sich das Wasser unter der Bundesstraße 27 in Lottstetten (Kreis Waldshut) rund einen… [+185 chars],,Starkregen: Auto bleibt in überfluteter Unterführung stecken. Hier finden Sie Informationen zu dem Thema „Starkregen“. Lesen Sie jetzt „Auto bleibt in überfluteter Unterführung stecken“.,Heavy rain: Car gets stuck in flooded underpass. Here you will find information on the topic of “heavy rain”. Read “Car gets stuck in flooded underpass” now.,"Imbribus gravis: Car haesit in inundatione underpass. Hic informationes invenies in argumento ""pluviae gravis"". Legere ""Car adhæsit in inundata underpass"" nunc.",2026-07-05 15:50:15+00:00
4ffb39c03446414edff9aa4eff0f622c,2026-07-03T23:42:22Z,'Unwetterwarnung',www.n-tv.de,de,0.9,Erneute Kehrtwende: England-Kracher wird trotz Unwetterwarnung nicht verlegt,Die nie bestätigten Pläne einer Verlegung der WM-Partie zwischen Mexiko und England sorgen für heftigen Ärger. Der Trainer des Co-Gastgebers zeigt sich entsetzt. Doch jetzt soll plötzlich alles beim Alten bleiben.,https://www.n-tv.de/sport/fussball-wm/England-Kracher-wird-trotz-Unwetterwarnung-nicht-verlegt-id31046846.html,https://www.n-tv.de/img/31046845/1783129023/Img_16_9/1200/July-1-2026-Atlanta-Georgia-USA-England-forward-Harry-Kane-9-argues-a-call-against-DR-Congo-during-their-World-Cup-Round-of-32-match-at-Atlanta-Stadium-in-Atlanta-Georgia-England-wins-the-game-2-1-in-regulation-play.jpg,http://web.archive.org/web/20260704021832/https://www.n-tv.de/sport/fussball-wm/England-Kracher-wird-trotz-Unwetterwarnung-nicht-verlegt-id31046846.html,Die nie bestätigten Pläne einer Verlegung der WM-Partie zwischen Mexiko und England sorgen für heftigen Ärger. Der Trainer des Co-Gastgebers zeigt sich entsetzt. Doch jetzt soll plötzlich alles beim … [+2373 chars],,Erneute Kehrtwende: England-Kracher wird trotz Unwetterwarnung nicht verlegt. Die nie bestätigten Pläne einer Verlegung der WM-Partie zwischen Mexiko und England sorgen für heftigen Ärger. Der Trainer des Co-Gastgebers zeigt sich entsetzt. Doch jetzt soll plötzlich alles beim Alten bleiben.,Another U-turn: England cracker will not be moved despite severe weather warnings. The never confirmed plans to postpone the World Cup game between Mexico and England are causing a lot of anger. The co-host's trainer is horrified. But now suddenly everything should stay the same.,Another U-turn: Angliae fragor non obstante gravibus tempestatibus monitis movebitur. Consilia numquam confirmata sunt ut ludum Mundi inter Mexico et Angliam differre multum irae causant. Exhorret exercitator cooperatoris. Sed nunc subito omnia eadem maneant.,2026-07-05 21:36:48+00:00
dca9d948bcd22a8be67622b092dca878,2026-07-01T16:43:14Z,'Regenmengen',burgenland.orf.at,de,0.9,Vereinzelt Sturm- und Unwetter-Einsätze,Der Wetterumschwung hat am Mittwoch auch teils heftige Gewitter – mit Starkregen und Hagel – gebracht. In Neudorf bei Landsee (Bezirk Oberpullendorf) sind mit 71 Litern pro Quadratmeter am Mittwoch die meisten Regenmengen gefallen.,https://burgenland.orf.at/stories/3360881/,https://ibs.orf.at/bgl?image=https%3A%2F%2Foekastatic.orf.at%2Fmims%2F2026%2F27%2F07%2Fcrops%2Fw%3D1200%2Ch%3D627%2Cq%3D75%2F3096748_master_1199307_landsee.jpg%3Fs%3D2ccce21012930aa274fe559be133a9eda4e4813e,http://web.archive.org/web/20260702011508/https://burgenland.orf.at/stories/3360881/,"Vor allem die Bezirke Oberwart und Oberpullendorf waren Mittwochnachmittag die Hotspots und dabei vor allem die Gemeinde Neudorf bei Landsee, wo innerhalb kürzester Zeit enorme Regenmengen vom Himmel… [+446 chars]",,Vereinzelt Sturm- und Unwetter-Einsätze. Der Wetterumschwung hat am Mittwoch auch teils heftige Gewitter – mit Starkregen und Hagel – gebracht. In Neudorf bei Landsee (Bezirk Oberpullendorf) sind mit 71 Litern pro Quadratmeter am Mittwoch die meisten Regenmengen gefallen.,"Occasional storm and severe weather operations. The change in the weather on Wednesday also brought severe thunderstorms - with heavy rain and hail. In Neudorf near Landsee (Oberpullendorf district), the most rainfall fell on Wednesday with 71 liters per square meter.",Tempestas interdum gravibusque tempestatibus competit. Haec mutatio tempestatis die Mercurii etiam graves tonitrua intulit cum pluvia et grandine. In Neudorf prope Landsee ( territorium Oberpullendorf ) pluviae maximae die Mercurii cum 71 quadratis metri litris ceciderunt.,2026-07-08 06:14:38+00:00
bdeb893205adab27809963bd42cb5980,2026-07-02T04:00:09Z,'Starkregen',www.bild.de,de,0.9,Nach Hitze und Gewitter kommt Trockenheit - Dem Rhein droht ein Schiffs-Stau!,"Erst die Hitzewelle, dann heftige Gewitter mit Starkregen und Hagel – jetzt droht Deutschland die nächste Stufe im Sommer 2026: Der Rhein trocknet aus.",https://www.bild.de/news/wetter/trockenes-wetter-dem-rhein-droht-ein-schiffsstau-6a44df16650749238cdc656f,"https://images.bild.de/6a44df16650749238cdc656f/6589b6b8f6c83e14fd0e0e7be4d3a31e,f4c0ac31?w=1280",http://web.archive.org/web/20260703032843/https://www.bild.de/news/wetter/trockenes-wetter-dem-rhein-droht-ein-schiffsstau-6a44df16650749238cdc656f,"TTS-Player überspringenArtikel weiterlesenErst die Hitzewelle, dann heftige Gewitter mit Starkregen und Hagel jetzt droht Deutschland die nächste Stufe im Sommer 2026: Der Rhein trocknet aus. Der Was… [+2661 chars]",,"Nach Hitze und Gewitter kommt Trockenheit - Dem Rhein droht ein Schiffs-Stau!. Erst die Hitzewelle, dann heftige Gewitter mit Starkregen und Hagel – jetzt droht Deutschland die nächste Stufe im Sommer 2026: Der Rhein trocknet aus.","After heat and thunderstorms comes drought - the Rhine is threatened with a ship jam! First the heat wave, then violent thunderstorms with heavy rain and hail - now Germany is threatened with the next stage in the summer of 2026: the Rhine dries up.","Post aestus et tonitrua siccitas venit - Navis jam Rhenus imminet! Primo aestus fluctuum, deinde imbrium et grandinum vehemens tonitribus - nunc Germania imminet, proxima aestatis 2026 scaena: Rhenus arescit.",2026-07-08 06:14:38+00:00
30551084fef3289d84418a0d8bf63c9b,2026-07-03T13:25:24Z,'Starkregen',www.tagesspiegel.de,de,0.9,"Mehr Dürre, Starkregen und Hitzewellen: Wetterbehörde erwartet dieses Jahr besonders starken El Niño","Das Klimaphänomen El Niño soll diesmal sehr intensiv ausfallen. Die Weltwetterbehörde mahnt mehr Vorbereitung an. Preise für Kakao, Kaffee und Zucker könnten weiter steigen.",https://www.tagesspiegel.de/wissen/mehr-durre-starkregen-und-hitzewellen-wetterbehorde-erwartet-dieses-jahr-besonders-starken-el-nino-15794543.html,https://www.tagesspiegel.de/images/15794594/alternates/BASE_16_9_W1400/1783084788000/wetterphanomen-el-nino.jpeg,http://web.archive.org/web/20260704050322/https://www.tagesspiegel.de/wissen/mehr-durre-starkregen-und-hitzewellen-wetterbehorde-erwartet-dieses-jahr-besonders-starken-el-nino-15794543.html,Die Welt muss sich aus Sicht der Weltwetterorganisation WMO wegen der erwarteten intensiven El-Niño-Phase verstärkt auf Extremwetter-Ereignisse vorbereiten. Wahrscheinlich werde es einen El Niño der … [+1944 chars],,"Mehr Dürre, Starkregen und Hitzewellen: Wetterbehörde erwartet dieses Jahr besonders starken El Niño. Das Klimaphänomen El Niño soll diesmal sehr intensiv ausfallen. Die Weltwetterbehörde mahnt mehr Vorbereitung an. Preise für Kakao, Kaffee und Zucker könnten weiter steigen.","More drought, heavy rain and heat waves: Weather authorities expect a particularly strong El Niño this year. The climate phenomenon El Niño is expected to be very intense this time. The World Weather Authority is calling for more preparation. Prices for cocoa, coffee and sugar could continue to rise.","Plures siccitatis, pluviae et aestus fluctuum sunt: ​​Tempestas authores El Niño hoc anno maxime fortes exspectant. phaenomenon climatis El Niño valde intensum hoc tempore exspectatur. Auctoritas Mundi Tempestatis in praeparatione vocat. Pretia pro Cocos, capulus et saccharum resurgere potuerunt.",2026-07-08 06:14:38+00:00
