index,published,keyword,domain,language,valid,title,description,url,image,archive,content,quote,de,en,la,added
bbe93195451e73260776f4f6f50ce7f8,2026-05-06T14:03:00Z,'Starkregen',www.stern.de,de,0.9,"Wetter: Starkregen und Hagel: Karten zeigen, wo Gewitter aufziehen",Nach starken Regenfällen drohen in einigen Regionen weiterhin Unwetter – teils sogar Gewitter mit Hagel möglich. Karten zeigen die aktuelle Lage.,https://www.stern.de/panorama/wetter/unwetter--starkregen-und-hagel---karten-zeigen--wo-gewitter-aufziehen-37374510.html,https://image.stern.de/37374566/t/rm/v1/w1440/r1.7778/-/unwetter-und-regen-in-deutschland.jpg,,"Kopiere den aktuellen Link
Zur Merkliste hinzufügen
Nach starken Regenfällen drohen in einigen Regionen weiterhin Unwetter teils sogar Gewitter mit Hagel möglich. Karten zeigen die aktuelle Lage.
… [+4402 chars]",,"Wetter: Starkregen und Hagel: Karten zeigen, wo Gewitter aufziehen. Nach starken Regenfällen drohen in einigen Regionen weiterhin Unwetter – teils sogar Gewitter mit Hagel möglich. Karten zeigen die aktuelle Lage.","Weather: Heavy rain and hail: Maps show where thunderstorms are approaching. After heavy rainfall, there is still a risk of severe weather in some regions - in some cases even thunderstorms with hail are possible. Maps show the current situation.","Tempestas: Imber et grando gravis: Maps monstrant ubi tonitribus appropinquant. Post imbres graves, in quibusdam regionibus adhuc periculum gravis tempestatis est, in quibusdam etiam cum grandine tonitribus fieri potest. Tabulae hodiernam condicionem ostendunt.",2026-05-08 21:35:59+00:00
cc00b4ac2395eedf2c6233f08a5a34de,2026-05-06T15:50:16Z,'Starkregen',www.bild.de,de,0.9,"Starkregen, Hagel und Gewitter - Amtliche Unwetterwarnung für Teile von Deutschland","Starkregen, Gewitter, Hagel, heftige Sturmböen: Der Deutsche Wetterdienst hat am Mittwochnachmittag eine amtliche Unwetterwarnung herausgegeben.",https://www.bild.de/news/wetter/unwetterwarnung-fuer-deutschland-starkregen-hagel-und-gewitter-am-mittwoch-69f9bed723e6b3dbf3c998f5,"https://images.bild.de/69f9bed723e6b3dbf3c998f5/a814221cc7f91830e8e1ece2b9bea62c,8f646b4d?w=1280",,"TTS-Player überspringenArtikel weiterlesenDer Deutsche Wetterdienst hat am Mittwochnachmittag für Teile von Deutschland eine amtliche Unwetterwarnung herausgegeben. Es ist mit schweren Gewittern, Sta… [+3881 chars]",,"Starkregen, Hagel und Gewitter - Amtliche Unwetterwarnung für Teile von Deutschland. Starkregen, Gewitter, Hagel, heftige Sturmböen: Der Deutsche Wetterdienst hat am Mittwochnachmittag eine amtliche Unwetterwarnung herausgegeben.","Heavy rain, hail and thunderstorms - official severe weather warning for parts of Germany. Heavy rain, thunderstorms, hail, violent squalls: The German Weather Service issued an official severe weather warning on Wednesday afternoon.","Imbribus gravis, grando et tonitribus - officialis gravis tempestatis admonitio in partibus Germaniae. Imbribus gravis, tonitribus, grando, procellae procellae: Ministerium Tempestatis Germanicae denuntiavit officialem tempestatem gravem die Mercurii post meridiem monentem.",2026-05-08 21:35:59+00:00
a85b5bc9c98833caae116c1053f7cf18,2026-05-07T03:56:49Z,'Starkregen',www.tagesspiegel.de,de,0.9,Wetter: Temperaturen steigen in Berlin und Brandenburg,Nach Starkregen im Süden Brandenburgs wird es wieder wärmer – am Wochenende sind die Aussichten besonders vielversprechend.,https://www.tagesspiegel.de/berlin/wetter-temperaturen-steigen-in-berlin-und-brandenburg-15567088.html,https://www.tagesspiegel.de/images/15567087/alternates/BASE_16_9_W1400/1778126208000/wolken-uber-berlin-und-brandenburg.jpeg,,In den kommenden Tagen wird es in Berlin und Brandenburg immer wärmer. Im Tagesverlauf liegen die Höchsttemperaturen laut dem Deutschen Wetterdienst (DWD) bei 11 bis 14 Grad. Dabei ist im Süden Brand… [+630 chars],,Wetter: Temperaturen steigen in Berlin und Brandenburg. Nach Starkregen im Süden Brandenburgs wird es wieder wärmer – am Wochenende sind die Aussichten besonders vielversprechend.,"Weather: Temperatures are rising in Berlin and Brandenburg. After heavy rain in the south of Brandenburg, it is getting warmer again - the prospects are particularly promising at the weekend.",Tempestas: Temperaturae Berolini et Brandenburgici oriuntur. Post pluvias in meridiem Brandenburgensem iterum calescit - spes in volutpat vestibulum maxime pollicetur.,2026-05-08 21:35:59+00:00
